,dialog
1771,JULES We gotta be real fuckin' delicate with this Jimmie situation.
1772,He's one remark away from kickin' our asses out the door.
1773,"VINCENT If he does, what do we do?"
1774,"Well, we ain't leavin' 'til we make a couple calls, but I don't want it to reach that pitch    Jimmie's a friend."
1775,You don't come into your friend's house and start tellin' him what's what.
1776,Just tell him not to be abusive.
1777,He kinda freaked out back there when he saw Marvin.
1778,"Put yourself in his position    It's 8o'clock in the morning, he just woke up."
1779,He wasn't expectin' this shit.
1780,We gotta remember here who's doin' who a favor.
1781,"If that favor means I gotta take shit, he can stick that favor straight up his ass."
1782,"Hey fuck, nigger, what the fuck'd you just do to his towel, man?"
1783,I was dryin' my hands!
1784,Well you're supposed to wash 'em first!
1785,Well you watched me wash 'em.
1786,I watched you get 'em wet.
1787,I was washin' 'em.
1788,This shit's hard to get off.
1789,Maybe if he'd had Lava I coulda done a better job.
1790,"I used the same fuckin' soap you did, and when I finished, the towel didn't look like no goddamn maxipad!"
1791,What if he was to come in here and see his towel like this?
1792,"It's shit like this that's gonna bring this situation to a head, man!"
1793,"Look, I ain't threatenin' you or nothin', all right?"
1794,You know I respect you and all.
1795,"But just don't put me in this position, all right?"
1796,All right.
1797,Fine. Fine.
1798,"Ask me nice like that, no problem."
1799,Just go handle your friend.
1800,Go ahead. I don't care.
1801,Mmm!
1802,"Goddamn, Jimmie!"
1803,This some serious gourmet shit.
1804,Me and Vincent would've been satisfied...
1805,with some freezedried Taster's Choice.
1806,Right?
1807,CHUCKLES And he springs this serious gourmet shit on us.
1808,What flavor is this?
1809,"Knock it off, Julie."
1810,What?
1811,I don't need you to tell me how fuckin' good my coffee is.
1812,I'm the one who buys it.
1813,I know how good it is.
1814,"When Bonnie goes shopping, she buys shit."
1815,"I buy the gourmet expensive stuff 'cause when I drink it, I wanna taste it."
1816,But you know what's on my mind right now? It ain't the coffee in my kitchen.
1817,It's the dead nigger in my garage.
1818,"Jimmie, don't even worry    No no no don't tell me about anything."
1819,I wanna ask you a question.
1820,"When you came pulling in here, did you notice the sign on the front of my house that said, ""Dead nigger storage""?"
1821,You know I ain't seen no    Did you notice the sign on the front of my house...
1822,"that said, ""Dead nigger storage""?"
1823,No. I didn't.
1824,You know why you didn't see that sign?
1825,SIGHS Why?
1826,"'Cause it ain't there, 'cause storing dead niggers ain't my fuckin' business, that's why!"
1827,"Hey Jimmie we're not gonna store the motherfucker    No no no no no no, don't you fuckin' realize..."
1828,"that if Bonnie comes home and finds a dead body in her house, I'm gonna get divorced?"
1829,No marriage counselor.
1830,No trial separation.
1831,I'm gonna get fuckin' divorced.
1832,Okay? And I don't wanna get fuckin' divorced!
1833,"Man, you know, fuck, I wanna help you, but I don't wanna lose my wife doin' it."
1834,"Jimmie, Jimmie, she ain't gonna leave you."
1835,"Don't fuckin' ""Jimmie"" me, Jules! Okay?"
1836,"Don't fuckin' ""Jimmie"" me."
1837,There's nothin' you're gonna say that's gonna make me forget I love my wife. Is there?
1838,"Now, look, you know, she comes home from work in about an hour and a half."
1839,The graveyard shift at the hospital.
1840,You gotta make some phone calls?
1841,You gotta call some people?
1842,"Well, then, do it, and then get the fuck out of my house before she gets here."
1843,That's Kool and the Gang.
1844,We don't wanna fuck your shit up.
1845,All I wanna do is call my people and get 'em to bring us in.
1846,You're fucking my shit up right now!
1847,You're gonna fuck my shit up big time if Bonnie comes home.
1848,"So just do me that favor, all right?"
1849,The phone is in my bedroom.
1850,I suggest you get going.
1851,"Well, say she comes home."
1852,What do you think she'll do?
1853,"Oh, no fuckin' shit she'll freak."
1854,That ain't no kinda answer.
1855,"I mean, you know, I don't."
1856,How much? A lot or a little?
1857,You got to appreciate what an explosive element...
1858,this Bonnie situation is.
1859,"She comes home from a hard day's work, finds a bunch of gangsters in her kitchen..."
1860,"doing a bunch of gangster shit, there ain't no tellin' what she's liable to do."
1861,"ALL GASPING Yeah, I grasp that, Jules."
1862,All I'm doing is contemplating the ifs.
1863,I don't wanna hear about no motherfuckin' ifs!
1864,"All I want to hear from your ass is, ""You ain't got no problem, Jules, I'm on the motherfucker."
1865,"Chill them niggers out and wait for the cavalry, which should be coming directly."" You ain't got no problem, Jules."
1866,I'm on the motherfucker.
1867,"Chill them niggers out and wait for the Wolf, who should be coming directly."
1868,You sendin' the Wolf?
1869,"Oh, you feel better, motherfucker?"
1870,"Shit, yeah, negro!"
1871,That's all you had to say!
1872,       PIANO THE WOLF She the hysterical type?
1873,When is she due?
1874,PARTYGOERS CHATTERING Mmhmm.
1875,Give me the principals' names again.
1876,MAN Place your bets.
1877,Jules. Mmhmm.
1878,"Cards, please."
1879,Vincent.
1880,Jimmie.
1881,Bonnie. Mmhmm.
1882,It's 30 minutes away.
1883,I'll be there in 10.
1884,"TIRES SCREECHING DOORBELL RINGS You're... Jimmie, right?"
1885,This is your house?
1886,It sure is.
1887,I'm Winston Wolf.
1888,I solve problems.
1889,Good. We got one.
1890,May I come in?
1891,"Uh, yeah. Please do."
1892,You must be Jules.
1893,Which would make you... Vincent.
1894,"Let's get down to brass tacks, gentlemen."
1895,"If I was informed correctly, the clock is ticking."
1896,"Is that right, Jimmie?"
1897,"Uh, one hundred percent."
1898,"Your wife Bonnie comes home at 9:30 in the a.m., correct?"
1899,Uhhuh.
1900,"I was led to believe if she comes home and finds us here, she wouldn't appreciate it much."
1901,She wouldn't at that.
1902,"That gives us 40 minutes to get the fuck outta Dodge, which, if you do what I say, when I say it, should be plenty."
1903,"Now, you got a corpse in a car, minus a head, in a garage. Take me to it."
1904,SIGHS Jimmie.
1905,Uhhuh.
1906,"Do me a favor, will ya?"
1907,Thought I smelled some coffee back there.
1908,Would you make me a cup?
1909,"Uh, yeah, sure."
1910,"Oh, uh, um, how do you take it?"
1911,"Lotsa cream, lotsa sugar."
1912,"About the car, is there anything I need to know? Does it stall?"
1913,Does it smoke? Does it make a lot of noise?
1914,Is there gas in it?
1915,"Aside from how it looks, the car's cool."
1916,Positive?
1917,Don't get me on the road and I find out the brake lights don't work.
1918,"Hey man, as far as I know, the motherfucker's tiptop."
1919,Good enough.
1920,Let's go back to the kitchen.
1921,"EXHALES Here you go, Mr. Wolf."
1922,"Thank you, Jimmie."
1923,Mmm.
1924,"Okay, first thing."
1925,You two.
1926,"Take the body, stick it in the trunk."
1927,"Now Jimmie, this looks to be a pretty domesticated house that would lead me to believe in the garage or under the sink you got a bunch of cleaners or cleansers or shit like that."
1928,"Yeah yeah Mr. Wolf, under the sink."
1929,Good. What I need you two fellas to do is take those cleaning products...
1930,"and clean the inside of the car    I'm talkin' fast, fast, fast."
1931,"You need to go in the back seat, scoop up all those little pieces of brain and skull."
1932,Get it out of there.
1933,Wipe down the upholstery.
1934,It don't need to be spickandspan.
1935,You don't need to eat off it.
1936,Just give it a good onceover.
1937,What you need to take care of are the really messy parts.
1938,"The pools of blood that have collected, you gotta soak that shit up."
1939,"Now Jimmie, we need to raid your linen closet."
1940,"I need blankets, I need comforters, quilts, bedspreads."
1941,"The thicker the better, the darker the better."
1942,No whites. Can't use 'em.
1943,We need to camouflage the interior of the car. We're gonna line the front seat and back seat and floorboards...
1944,"with quilts and blankets, so if a cop stops us and starts stickin' his big snout in the car, the subterfuge won't last, but at a glance the car will appear to be normal."
1945,"Jimmie, lead the way."
1946,"Boys, get to work."
1947,"""Please"" would be nice."
1948,Come again?
1949,"I said, a ""please"" would be nice."
1950,"Get it straight, Buster."
1951,I'm not here to say please.
1952,I'm here to tell you what to do.
1953,"And if selfpreservation is an instinct you possess, you'd better fuckin' do it and do it quick."
1954,I'm here to help.
1955,"If my help's not appreciated, lotsa luck, gentlemen."
1956,"No, Mr. Wolf, it ain't like that; your help is definitely appreciated."
1957,"Mr. Wolf, listen. I don't mean disrespect, okay?"
1958,I respect you.
1959,I just don't like people barkin' orders at me.
1960,"If I'm curt with you, it's because time is a factor."
1961,"I think fast, I talk fast, and I need you guys to act fast if you wanna get out of this."
1962,"So pretty please, with sugar on top, clean the fuckin' car."
1963,"Don't be lookin' at me like that, all right?"
1964,I can feel your look.
1965,It's a 1974 Chevy Nova.
1966,SIPPING Green.
1967,Nothin' except for the mess inside.
1968,"Mmm, about 20 minutes."
1969,Nobody who'll be missed.
1970,"You're a good man, Joe."
1971,Thanks a bunch.
1972,"How we comin', Jimmie?"
1973,"Uh, pretty good."
1974,"I got it all here, but, uh, SIGHS Mr. Wolf, you gotta understand something."
1975,"Winston, Jimmie, Winston."
1976,"Okay. You gotta understand something, uh, Winston."
1977,"Uh    Uh, no, thank you."
1978,"Uh, this is our best linen here, and it's, uh    it was a wedding present..."
1979,from my Uncle Conrad and my Aunt Ginny.
1980,They're not with us anymore. And I really wanna help you guys out and all    Let me ask you a question.
1981,If you don't mind.
1982,"No, no, please."
1983,Go ahead.
1984,"Your Uncle Conrad and Aunt ginny, were they millionaires?"
1985,No.
1986,"Well, your Uncle Marsellus is."
1987,And I'm positive that if Uncle Conrad and Aunt...
1988,Ginny.
1989,"Ginny were here, they would furnish you with a whole bedroom set, which your Uncle Marsellus is more than happy to do."
1990,I like oak myself.
1991,That's what I have in my bedroom.
1992,"How about you, Jimmie?"
1993,You an oak man?
1994,Oak's nice.
1995,"Oh, man, I will never forgive your ass for this shit."
1996,"This is some fuckedup, repugnant shit."
1997,"Jules, did you ever hear the philosophy that once a man admits that he is wrong, that he is immediately forgiven for all wrongdoings?"
1998,Get the fuck out my face with that shit!
1999,The motherfucker that said that shit never had to pick up ittybitty pieces of skull...
2000,on account of your dumb ass.
2001,"I got a threshold, Jules, for the abuse that I will take."
2002,"Right now, I'm a fuckin' race car, and you got me in the red."
2003,I'm just sayin' it's fuckin' dangerous to have a race car in the fuckin' red.
2004,That's all. I could blow.
2005,"Oh, oh, you ready to blow?"
2006,Yeah.
2007,"Well, I'm a mushroomcloudlayin' motherfucker, motherfucker."
2008,"Every time my fingers touch brain, I'm Superfly T.N.T."
2009,I'm the Guns of the Navarone.
2010,"In fact, what the fuck am I doin' in the back?"
2011,You're the motherfucker should be on brain detail!
2012,We're fuckin' switchin'!
2013,"I'm washin' windows, you're pickin' up this nigger's skull!"
2014,"Fine job, gentlemen."
2015,You may get out of this yet.
2016,I can't believe this is the same car.
2017,"Well, let's not start suckin' each other's dicks quite yet."
2018,Phase one is complete    clean the car    which moves us right along to phase two: clean you two.
2019,Strip.
2020,All the way?
2021,WOLF To your bare ass.
2022,"Quickly, gentlemen."
2023,We got about 15 minutes...
2024,before Jimmie's better half comes pulling into the driveway.
2025,"Goddamn, this morning air is some chilly shit."
2026,Are you sure this is absolutely necessary?
2027,You know what you two look like?
2028,VINCENT What?
2029,Like a couple of guys who just blew off somebody's head.
2030,Strippin' off those bloody rags is absolutely necessary.
2031,Toss 'em in Jimmie's garbage bag.
2032,"Don't do nothin' stupid, like leavin' this shit out front for Otto the garbageman to pick up."
2033,You know what I'm sayin'?
2034,"Don't worry, we're taking it with us."
2035,"Jim, the soap."
2036,Vincent.
2037,"WOLF Okay, gentlemen."
2038,"You both been to county before, I'm sure. Here it comes."
2039,Goddamn!
2040,The water's fuckin' cold!
2041,Yo! Yo! Yo!
2042,"Better you than me, gentlemen."
2043,CHUCKLING Don't be afraid of the soap.
2044,Spread it around.
2045,YELLING CONTINUES Get 'em there a little bit.
2046,Vincent's hair.
2047,"Hey, get out of my hair!"
2048,"Come on, do it, goddamn it! Do it!"
2049,"Uh, um    Towel."
2050,WOLF You're dry enough.
2051,Toss 'em their clothes.
2052,WOLF LAUGHING Perfect.
2053,Perfect. We couldn't have planned this better.
2054,"You guys look like    What do they look like, Jimmie?"
2055,Dorks. They look like a couple of dorks.
2056,"LAUGHING BOTH LAUGHING Hahaha. They're your clothes, motherfucker."
2057,"Come on, gentlemen."
2058,We're laughing our way right into prison.
2059,Don't make me beg.
2060,"Okay, gentlemen, let's get our rules of the road straight."
2061,We're going to a place called Monster Joe's Truck and Tow.
2062,Monster Joe and his daughter Raquel are sympathetic to our dilemma.
2063,"The place is North Hollywood, so a few twists and turns aside, we'll be goin' up Hollywood Way."
2064,"Now, I'll drive the tainted car."
2065,"Jules, you ride with me."
2066,"Vincent, you follow in my Acura."
2067,"Now, if we come across the path of any John Q. Laws, nobody does a fuckin' thing 'til I do something."
2068,Right.
2069,What did I say?
2070,Don't do shit unless.
2071,Unless what?
2072,Unless you do it first.
2073,Spoken like a true prodigy.
2074,"How about you, Lash LaRue?"
2075,Can you keep your spurs from jingling and jangling?
2076,"Mr. Wolf, look, the gun went off."
2077,I don't know why.
2078,"I'm cool, I promise you."
2079,"Fair enough. Now, I drive real fuckin' fast, so keep up."
2080,"If I get my car back any different than I gave it, Monster Joe's gonna be disposing of two bodies."
2081,"METAL DOOR SLAMMING ENGINE IDLING Outta my way, Rex."
2082,We cool?
2083,Like it never happened.
2084,VINCENT All right.
2085,"Boys, this is Raquel."
2086,Someday all this will be hers.
2087,"Hi. So, what's with the outfits?"
2088,You guys going to a volleyball game or something?
2089,WOLF LAUGHS I'm takin' milady out to breakfast.
2090,Maybe I could drop you two off.
2091,Where do you live?
2092,Redondo.
2093,Inglewood.
2094,It's    It's your future. I    I see a    a cab ride.
2095,"Move outta the sticks, fellas."
2096,"Say good night, Raquel."
2097,"Good night, Raquel."
2098,I'll see you guys around.
2099,"Stay outta trouble, you crazy kids."
2100,"Mr. Wolf, I just wanna tell you it was a real pleasure watching you work."
2101,"Yeah, really. And thank you very much, Mr. Wolf."
2102,Call me Winston.
2103,"You see that, young lady?"
2104,Respect.
2105,ALARM DEACTIVATES Respect for one's elders shows character.
2106,I have character.
2107,Because you are a character doesn't mean that you have character.
2108,CHUCKLES TIRES SCREECHING Wanna share a cab?
2109,I'd go for some breakfast.
2110,Feel like havin' breakfast with me?
2111,PHONE DIALING Cool.
2112,"I don't know why, I just thought he'd be European or something."
2113,"Yeah, he's about as European as fuckin' English Bob."
2114,I know that now.
2115,But was he cool or what?
2116,Thank you.
2117,"Totally fuckin' cool, in control."
2118,Didn't even really get pissed when you were fuckin' with him; I was amazed.
2119,CHUCKLES Want some bacon?
2120,"No, man, I don't eat pork."
2121,Are you Jewish?
2122,"I ain't Jewish; I just don't dig on swine, that's all."
2123,Why not?
2124,Pigs are filthy animals.
2125,I don't eat filthy animals.
2126,"Yeah, but bacon tastes good."
2127,Pork chops taste good.
2128,"Sewer rat may taste like pumpkin pie, but I'd never know..."
2129,'cause I wouldn't eat the filthy motherfuckers.
2130,Pigs sleep and root in shit.
2131,That's a filthy animal.
2132,I ain't eatin' nothin' ain't got sense enough to disregard its own feces.
2133,How about a dog?
2134,Dog eats its own feces.
2135,I don't eat dog either.
2136,"Yeah, but do you consider a dog to be a filthy animal?"
2137,"I wouldn't go so far as to call a dog filthy, but they're definitely dirty."
2138,But a dog's got personality.
2139,Personality goes a long way.
2140,"Ah, so, by that rationale, if a pig had a better personality, he would cease to be a filthy animal."
2141,Is that true?
2142,We'd have to be talkin' about one charming motherfuckin' pig.
2143,"I mean, he'd have to be that Arnold on Green Acres."
2144,"BOTH LAUGHING Oh, man, that's good."
2145,"That's good, man."
2146,You're startin' to lighten up.
2147,"You've been sittin' there, all serious and shit."
2148,"I just been sittin' here, thinkin'."
2149,About what?
2150,About the miracle we witnessed.
2151,Miracle you witnessed.
2152,I witnessed a freak occurrence.
2153,"What is a miracle, Vincent?"
2154,Act of God.
2155,And what's an act of God?
2156,"When, um, God makes the impossible possible."
2157,But this morning...
2158,I don't think qualifies.
2159,"Hey, Vincent."
2160,"Don't you see, that shit don't matter."
2161,You're judging this shit the wrong way.
2162,"I mean it could be God stopped the bullets, changed Coke to Pepsi, found my car keys."
2163,You don't judge shit like this based on merit.
2164,"Now, whether or not what we experienced..."
2165,was an AccordingtoHoyle miracle is insignificant.
2166,"But what is significant is, I felt the touch of God."
2167,God got involved.
2168,But why?
2169,"Well, that's what's fuckin' with me: I don't know why."
2170,But I can't go back to sleep.
2171,You're serious.
2172,You're really thinkin' about quittin'.
2173,For life?
2174,Yeah.
2175,Most definitely.
2176,Fuck.
2177,What you gonna do then?
2178,"Well, that's what I been sitting here contemplating."
2179,First I'm gonna deliver this case to Marsellus.
2180,"Then, basically, I'm just gonna walk the earth."
2181,"What you mean, ""Walk the earth""?"
2182,Like Caine in Kung Fu.
2183,"Walk from place to place, meet people, get in adventures."
2184,And how long do you intend to walk the earth?
2185,'Til God puts me where he wants me to be.
2186,And what if he don't do that?
2187,"If it takes forever, then I'll walk forever."
2188,So you decided to be a bum.
2189,"I'll just be Jules, Vincent."
2190,"No more, no less."
2191,"No, Jules, you decided to be a bum, just like all those pieces of shit out there who beg for change, who sleep in garbage bins, eat what I throw away."
2192,"They got a name for that, Jules    It's called a bum."
2193,"And without a job, a residence or legal tender, that's what you're gonna be, man."
2194,You're gonna be a fuckin' bum.
2195,"Look, my friend, this is just where you and I differ."
2196,Gar  on! Coffee!
2197,"Jules, look, what happened this morning, man, I agree it was peculiar."
2198,"But water into wine, I    All shapes and sizes, Vincent."
2199,"Don't fuckin' talk to me that way, man."
2200,"If my answers frighten you, then you should cease asking scary questions."
2201,I'm gonna take a shit.
2202,Let me ask you something.
2203,"When did you make this decision, when you were sittin' there eatin' that muffin?"
2204,"Yeah. I was sittin' here eatin' my muffin, drinkin' my coffee, replayin' the incident in my head, when I had what alcoholics refer to as a moment of clarity."
2205,Fuck.
2206,To be continued.
2207,"I love you, pumpkin."
2208,"I love you, honey bunny."
2209,Everybody be cool!
2210,This is a robbery!
2211,CUSTOMERS MURMURING Any one of you fucking pricks move and I'll execute every one of you motherfuckers!
2212,You got that?
2213,You just be quiet over there!
2214,Waitresses on the floor!
2215,Get on the fuckin'    get the fuck down!
2216,You're in a blind spot.
2217,"Take your dames over to that booth, on the count of ten!"
2218,"Mexicans, out of the fucking kitchen!"
2219,"1, 2, 3, 4, 5, 6, 7, 8    What the fuck are you doing, you fucking yuppie? Get down!"
2220,"You fucking hairy yuppie, get down."
2221,Throw those bags!
2222,Fucking move! Move!
2223,       RANCHERO COOKS SPEAKING SPANISH Move! Get the fuck    Get down on the fucking floor!
2224,Grandpa! Down!
2225,"I'm the manager here, and there's no problem."
2226,No problem at all.
2227,You gonna give me a problem?
2228,"No, sir, I'm not."
2229,Thought you said you were gonna give me a fucking problem!
2230,"I think we got a hero here, honey bunny."
2231,"Well, just execute him!"
2232,PANTING I am not a hero.
2233,I'm just a coffee shop manager.
2234,Get the fuck down!
2235,The restaurant's ours!
2236,Just take whatever you want.
2237,PANTING You talk to the customers.
2238,Yeah.
2239,"You tell them to be fucking cool, Yes."
2240,and everything will be over.
2241,You understand me?
2242,Yes!
2243,"Listen, everybody."
2244,"Be calm, cooperate, and this'll all be over in a minute!"
2245,Get the fuck down!
2246,Well done.
2247,"       COUNTRY/WESTERN MUZAK All right, now, people, gonna come around and collect your wallets!"
2248,"You don't fucking talk, you just throw 'em in the bag!"
2249,Are we clear?
2250,"I said, are we fucking clear?"
2251,Good!
2252,"Now, wallets out!"
2253,PUMPKIN That's it.
2254,Get the fuck down.
2255,In the bag.
2256,In the fucking bag!
2257,"CUSTOMER I don't have nothin' on me, man."
2258,In the bag.
2259,What am I waiting for?
2260,In the fucking bag.
2261,Laura. Laura. Tips.
2262,In the bag.
2263,Is that a cellular phone?
2264,Yeah.
2265,In the fucking bag.
2266,"Tidy up, tidy up, that's it."
2267,Now get the fuck down on the floor.
2268,In the bag.
2269,In the bag.
2270,In the bag.
2271,What's in the case?
2272,My boss' dirty laundry.
2273,Your boss makes you do his laundry?
2274,When he wants it clean.
2275,Sounds like a shit job.
2276,"Funny, I was thinkin' the same thing."
2277,Open it.
2278,'Fraid I can't do that.
2279,I didn't hear you.
2280,"Yes, you did."
2281,What's going on?
2282,Looks like we got a vigilante in our midst.
2283,Shoot him in the face!
2284,"I hate to shatter your ego, but this ain't the first time I've had a gun pointed at me."
2285,"If you don't take your hand off that case, it'll be your last."
2286,MANAGER Stop causing problems!
2287,You'll get us all killed!
2288,Give 'em what you got and get 'em outta here!
2289,"Shut the fuck up, fat man!"
2290,This ain't none of your goddamn business!
2291,"Be cool, honey bunny, be cool."
2292,No problem.
2293,I got it under control.
2294,"Now, I'm gonna count to three."
2295,"If you don't open that case, I'm gonna unload in your fucking face."
2296,We clear?
2297,One.
2298,Two.
2299,Three.
2300,"Okay, Ringo."
2301,You win.
2302,It's yours.
2303,Open it.
2304,"LATCHES SPRINGING HONEY BUNNY Hey, what is it?"
2305,What is it?
2306,Is that what I think it is?
2307,Mmhmm.
2308,It's beautiful.
2309,"GIGGLING Goddamn it, what is it?"
2310,You let him go!
2311,You let him go!
2312,"Let go of him, or I'm gonna kill you!"
2313,Tell that bitch to be cool.
2314,"Say, ""Bitch, be cool!"" Say, ""Bitch, be cool!"" Be cool! Be cool!"
2315,Tell that bitch to chill!
2316,You're gonna die so fuckin' bad!
2317,Chill that fuckin' bitch out!
2318,"Chill out, honey bunny!"
2319,Let go of him!
2320,"Chill out, honey bunny!"
2321,"Now, promise her it's gonna be all right!"
2322,I promise!
2323,Tell her to chill!
2324,"Chill out, honey bunny!"
2325,Now tell me her name.
2326,Yolanda.
2327,"All right, now, Yolanda, we're not gonna do anything stupid, are we?"
2328,Don't you hurt him!
2329,Nobody's gonna hurt anybody!
2330,We're all gonna be like three little Fonzies here.
2331,And what's Fonzie like?
2332,"Come on, Yolanda!"
2333,What's Fonzie like?
2334,He's cool.
2335,What?
2336,Cool.
2337,Correctamundo.
2338,And that's what we're gonna be.
2339,We're gonna be cool.
2340,"Now, Ringo, I'm gonna count to three."
2341,"And when I count three, I want you to let go of your gun, put your palms flat on the table and sit your ass down."
2342,"And when you do it, you do it cool."
2343,You ready?
2344,"One, two, three."
2345,"PANTING Okay, now you let him go!"
2346,Yolanda!
2347,I thought you were gonna be cool.
2348,"Now, when you yell at me, it makes me nervous."
2349,"When I get nervous, I get scared."
2350,"When motherfuckers get scared, that's when motherfuckers accidentally get shot."
2351,"Just know, you hurt him, you die."
2352,"Well, that seems to be the situation."
2353,But I don't want that.
2354,And you don't want that.
2355,And Ringo here definitely doesn't want that.
2356,So let's see what we can do.
2357,Now...
2358,here's the situation.
2359,"Normally both your asses would be dead as fuckin' fried chicken, but you happened to pull this shit while I'm in a transitional period, and I don't wanna kill you; I wanna help you."
2360,"But I can't give you this case, 'cause it don't belong to me."
2361,"Besides, I been through too much shit over this case this morning..."
2362,to just hand it over to your dumb ass.
2363,Vincent!
2364,YELLS Be cool!
2365,"Yolanda, it's cool, baby."
2366,Get back!
2367,It's cool!
2368,We still just talkin'.
2369,Come on. Point the gun at me.
2370,Point the gun at me.
2371,YOLANDA WHIMPERING There you go.
2372,"Now, Vincent, you just hang back..."
2373,and don't do a goddamn thing.
2374,Tell her it's still cool.
2375,"It's still cool, honey bunny."
2376,"How we doin', baby?"
2377,I    I gotta go pee.
2378,I wanna go home.
2379,"Hang in there, baby."
