,dialog
619,"    School gal, baby gonna tell you some news         Sure do look good in them babydoll shoes         It's one, two, buckle the shoes three, four, get out on the floor         Five, six, come get your kicks down at the corner of Lincoln and 46th, yeah         All right         I've been waitin' in school all day long         Waiting on the bell to ring so I can go home         Throw my books on the table Pick up the telephone         Come on, baby     MAN Coffee, please? Decaf!"
620,MARILYN Just a minute.
621,"    Heading down to the drugstore to get a soda pop         Throw a nickel in the jukebox then we start to rock         School gal baby gonna tell you some news         You sure do look good in them babydoll shoes         Well, it's one, two buckle the shoes         Three, four get out on the floor         Five, six, come get your kicks down at the corner of Lincoln and 46th     CHATTERING     Gonna rock all night just wait and see        MAN Ricky, Ricky, Ricky!"
622,PEOPLE CHEERING ED SULLIVAN IMPERSONATOR Let's hear it for Ricky Nelson!
623,"Fantastic job, Rick."
624,Thank you very much.
625,MIA Vincent!
626,"SULLIVAN Ah just to let you all know, Ricky will be back in the second half of our show, so we hope you enjoy your meals here at Jackrabbit Slim's."
627,Thank you.
628,Call for...
629,WAITER Phillip Morris.
630,MIA What do you think?
631,I think it's like a wax museum with a pulse.
632,"Hi, I'm Buddy."
633,What can I get you?
634,"       ""LONESOME TOWN"" Let's see, steak, steak, steak."
635,"Oh, yeah, I'll have the Douglas Sirk steak."
636,I'll have that.
637,How do you want that cooked?
638,Burned to a crisp or bloody as hell?
639,"Bloody as hell, and    Oh, yeah, look at this    vanilla Coke."
640,"What about you, Peggy Sue?"
641,I'll have the...
642,"Durward Kirby burger, bloody."
643,And... a fivedollar shake.
644,"How do you want that shake, Martin and Lewis, or Amos 'n Andy?"
645,Martin and Lewis.
646,Did you just order a fivedollar shake?
647,Mmhmm.
648,That's a shake?
649,That's milk and ice cream?
650,Last I heard.
651,That's five dollars? You don't put bourbon in it or nothin'?
652,No.
653,Just checking.
654,I'll be right back with your drinks.
655,"JUKEBOX     To lonesome town         To cry my troubles away     Could you, um..."
656,"roll me one of those, cowboy?"
657,"You can have this one, cowgirl."
658,Thanks.
659,IGNITES LIGHTER     The streets are filled with regret     Think nothin' of it.
660,    Lay me down in lonesome town         I can learn to forget        So...
661,Marsellus said you just got back from Amsterdam.
662,Sure did.
663,How long were you there?
664,INHALES Just over three years.
665,I go there about once a year to chill out for a month.
666,No kiddin'?
667,I didn't know that.
668,Why would you?
669,"       ""ACE OF SPADES"" I heard you did a pilot."
670,That was my 15 minutes.
671,What was it?
672,"It was a show about a team of female secret agents called ""Fox Force Five""."
673,What?
674,Fox Force Five.
675,"Fox, as in were a bunch of foxy chicks."
676,"Force, as in we're a force to be reckoned with."
677,"And five, as in there's onetwothreefourfive of us."
678,"There was a blond one, Sommerset O'Neal."
679,She was the leader.
680,The Japanese fox was a kung fu master.
681,The black girl was a demolition expert.
682,French Fox's speciality was sex.
683,What was your speciality?
684,Knives.
685,"The character I played, Raven McCoy, her background was she grew up raised by circus performers."
686,"According to the show, she was the deadliest woman in the world with a knife."
687,And she knew a zillion old jokes.
688,"Her grandfather, an old vaudevillian, taught her."
689,"And if we would have got picked up, they would've worked in a gimmick..."
690,where every show I would've told another joke.
691,You know any of them old jokes?
692,"Well, I only got the chance to say one 'cause we only did one show."
693,Tell me.
694,It's corny.
695,Don't be that way.
696,Tell me.
697,"No, you wouldn't like it, and I'd be embarrassed."
698,"You'd be embarr    You told 50 million people, and you can't tell me?"
699,I promise I won't laugh.
700,"That's what I'm afraid of, Vince."
701,That's not what I meant.
702,You know it.
703,Now I'm definitely not gonna tell you 'cause it's been built up too much.
704,What a gyp.
705,SIGHS Martin and Lewis.
706,Vanilla Coke.
707,Mmm.
708,Yummy.
709,You think I could have a sip of that?
710,Be my guest.
711,I gotta know what a fivedollar shake tastes like.
712,You can use my straw.
713,I don't have cooties.
714,"Yeah, but maybe I do."
715,Cooties I can handle.
716,All right.
717,"       ""RUMBLE"" BEGINS Goddamn, that's a pretty fuckin' good milk shake!"
718,Told ya.
719,"I don't know if it was worth five dollars, but it's pretty fuckin' good."
720,       CONTINUES Don't you hate that?
721,Hate what?
722,Uncomfortable silences.
723,Why do we feel it's necessary to yak about bullshit in order to be comfortable?
724,I don't know.
725,That's a good question.
726,That's when you know you found somebody really special.
727,When you can just shut the fuck up for a minute and comfortably share silence.
728,"Well, I don't think we're quite there yet, but don't feel bad."
729,We just met each other.
730,I'll tell you what.
731,I'm gonna go to the bathroom and powder my nose.
732,You sit here...
733,and think of something to say.
734,I'll do that.
735,Okay.
736,WOLF WHISTLE PEOPLE APPLAUDING SNIFFING I said goddamn!
737,Goddamn!
738,Goddamn.
739,WOMAN I need some hair spray.
740,"       ""SINCE I FIRST MET YOU"" Mmmm."
741,Don't you just love it when you come back from the bathroom to find your food waiting for you?
742,We're lucky we got anything at all.
743,I don't think Buddy Holly's much of a waiter.
744,Maybe we should've sat in Marilyn Monroe's section.
745,Which one?
746,There's two Monroes.
747,"No, there's not."
748,That is Marilyn Monroe.
749,That is Mamie Van Doren.
750,"I don't see Jayne Mansfield, so she must have the night off."
751,Pretty smart.
752,Yeah. I got my moments.
753,So did you think of somethin' to say?
754,"Actually, I did."
755,However...
756,"you seem like a really nice person, and I    I don't want to offend you."
757,Oooh.
758,"This doesn't sound like the usual, mindless, boring, gettin'toknowyou chitchat."
759,This sounds like you actually have somethin' to say.
760,"Well, well, I do. I do."
761,INHALES But you have to promise not to be offended.
762,"No, no no no."
763,You can't promise somethin' like that.
764,I have no idea what you're gonna ask me.
765,"You can ask me what you're gonna ask me, and my natural response could be to get offended."
766,"Then through no fault of my own, I would have broken my promise."
767,Let's just forget it.
768,That's an impossibility.
769,Trying to forget anything as intriguing as this would be an exercise in futility.
770,Is that a fact?
771,"And besides, isn't it more, uh, exciting when you don't have permission?"
772,"All right, all right."
773,"Well, here goes."
774,What did you think about what happened to Antwan?
775,Who's Antwan?
776,Tony Rocky Horror. You know him.
777,He fell out of a window.
778,Hmm. Hmm.
779,"Well, that is one way to say it."
780,Another way to say it would be that he was thrown out.
781,Another way would be he was thrown out by Marsellus.
782,"Yet, even another way is to say he was thrown out of a window by Marsellus because of you."
783,Is that a fact?
784,No.
785,"No, it's not a fact."
786,It's just what I heard.
787,That's just what I heard.
788,Who told you?
789,They.
790,"""They"" talk a lot, don't they?"
791,CHUCKLES They certainly do.
792,They certainly do.
793,"Don't be shy, Vincent."
794,"What else did ""they"" say?"
795,Well I'm    I'm not shy.
796,"Um    Did it involve the ""F"" word?"
797,"Nono, no, no, no, no."
798,They just said that Antwan had given you a foot massage.
799,And?
800,And    And nothin'.
801,That's it.
802,You heard Marsellus...
803,threw Tony Rocky Horror out of a fourthstory window for giving me a foot massage?
804,Mmhmm.
805,And you believe that?
806,"CHUCKLES Well, I mean, the time I was told it sounded reasonable."
807,Marsellus throwing Tony out of a fourthstory window...
808,for massaging my feet seemed reasonable?
809,"No, it seemed excessive, but that doesn't mean it didn't happen."
810,I understand that Marsellus is very protective of you.
811,A husband being protective of his wife is one thing.
812,A husband almost killing another man for touching his wife's feet is something else.
813,But did it happen?
814,Only thing Antwan ever touched of mine was my hand when he shook it...
815,at my wedding.
816,Really?
817,"Truth is, nobody knows why Marsellus threw Tony out that window..."
818,except Marsellus and Tony.
819,"When you little scamps get together, you're worse than a sewing circle."
820,Ladies and gentlemen.
821,Now the moment you've all been waiting for.
822,The worldfamous Jackrabbit Slim's twist contest.
823,"APPLAUSE Now, this is where one lucky couple..."
824,will win this handsome trophy that Marilyn here is holding.
825,"Now, who will be our first contestants?"
826,Right here!
827,MAN All right!
828,I wanna dance.
829,"No, no, no, no, no, no."
830,"No, no, no, no, no, no, no."
831,"I do believe Marsellus, my husband, your boss, told you to take me out and do whatever I wanted."
832,Now I wanna dance; I wanna win; I want that trophy.
833,So dance good.
834,All right. You asked for it.
835,Let's hear it for our first contestants.
836,Now let's meet our first contestants here this evening.
837,"Young lady, what is your name?"
838,Mrs. Mia Wallace.
839,And how 'bout your fella here?
840,Vincent Vega.
841,"All right, let's see what you can do. Take it away!"
842,WOMAN Go for it.
843,MAN Come on!
844,"       ""YOU NEVER CAN TELL""     It was a teenage wedding and the old folks wished them well         You could see that Pierre did truly love the mademoiselle         And now the young monsieur and madame have rung the chapel bell         C'est la vie say the old folks It goes to show you never can tell         They furnished off an apartment with a tworoom Roebucks sale         The 'coolerador was crammed with TV dinners and ginger ale         But when Pierre found work the little money comin' worked out well         C'est la vie say the old folks It goes to show you never can tell         They had a hifi phono and boy did they let it blast         Seven hundred little records all rock, rhythm and jazz         But when the sun went down the rapid tempo of the music fell         C'est la vie say the old folks It goes to show you never can tell         They had a teenage wedding and the old folks wished them well         You could see that Pierre did truly love the mademoiselle        SIGHS ALARM FAINTLY BEEPING BEEPING STOPS BOTH LAUGHING Is that what you call an uncomfortable silence?"
845,I don't know what you call that.
846,CHUCKLES Drinks! Music!
847,I'm gonna take a piss.
848,"That's a little bit more information than I needed, Vince, but go right ahead."
849,"       ""GIRL, YOU'LL BE A WOMAN SOON""     Girl     MIA Bomp, bomp, bom     You'll be a woman soon         I love you so much Can't count all the ways         I'd die for you, girl and all they can say is     SINGING WITH TAPE     He's not your kind         You never get tired of putting me down and I never know when I come around         What I'm gonna find         Don't let them make up your mind         Don't you know, girl     MIA Bomp bomp bom."
850,"    You'll be a woman soon     One drink, and that's it."
851,Don't be rude.
852,"Drink your drink, but do it quickly."
853,Say good night...
854,and go home.
855,"    Girl         You'll be a woman soon         Soon         You'll need a man         I've been misunderstood for all of my life         But what they're sayin', girl it cuts like a knife         The boy's no good         Well, I've finally have found what I been lookin' for         But if they get a chance they'll end it for sure, sure they would         Baby, I've done all I could     SIGHS You see, this is a moral test of oneself whether or not you can maintain loyalty."
856,Because... being loyal is very important.
857,"    You never get tired of putting me down and I never know when I come around         What I'm gonna find         Don't let them make up your mind         Don't you know, girl         You'll be a woman soon         Please         Come take my hand         Girl         You'll be a woman soon         Please         Come take my hand     Hello."
858,"    Girl     So, you're gonna go out there and you're gonna say, ""Good night."
859,"I've had a very lovely evening."" Walk out the door, get in the car, go home, jerk off and that's all you gonna do."
860,"    Now it's up to you, girl         You'll be a woman soon         Please     SNIFFING     Come take my hand         Girl     MOANS     You'll be a woman soon     BREATHING HEAVILY     Soon         You'll need a man        MUSIC FADES BATHROOM DOOR OPENS All right, Mia."
861,"So listen, I gotta go, all right?"
862,"Oh, Jesus fucking Christ."
863,"You fu    Oh, Jesus Christ!"
864,"Oh, fuck me."
865,Fuck me!
866,"Oh    Come on, girl."
867,We're gettin' outta here.
868,We gotta walk now.
869,"TIRES SCREECHING Don't fuckin' die on me, Mia!"
870,Fuck!
871,DIALING Answer.
872,TELEPHONE RINGING MAN ON TELEVISION Have you got the ring?
873,"Why, certainly."
874,"Join hands, you two lovebirds."
875,RINGING CONTINUES WOMAN Please! Please!
876,"Yes, yes. Hold hands, you lovebirds."
877,"RINGING CONTINUES PEOPLE ON TELEVISION YELLING, SHOUTING RINGING Fuck you, Lance!"
878,Answer!
879,"RINGING CONTINUES YELLING, SHOUTING CONTINUE ON TELEVISION WOMAN ON TELEVISION Now what do you say?"
880,MAN ON TELEVISION I give up!
881,I'll marry you!
882,RINGING CONTINUES JODY Lance!
883,The goddamn phone's ringing!
884,I can hear it.
885,JODY I thought you told those fuckin' assholes never to call here this late!
886,"Yeah, I told them."
887,And that is exactly what I'm going to tell this fucking asshole right now.
888,WOMAN ON TELEVISION Don't you dare strike me!
889,Hello.
890,Lance! Vincent.
891,"I'm in big fuckin' trouble, man."
892,I'm coming to your house.
893,WWhoa. Whoa.
894,"Hold your horses, man."
895,WWhat's the problem?
896,"I got this chick, she's fuckin' O.D.in' on me!"
897,"Well, don't bring her here!"
898,I'm not even joking with you!
899,Do not be bringing some fuckedup poohbah to my house!
900,No choice.
901,Wh    She's O.D.in'?
902,"She's fuckin' dyin' on me, man!"
903,MAN ON TELEVISION Just dandy.
904,"Okay, then you bite the fuckin' bullet, take her to a hospital and call a lawyer."
905,Negative!
906,"This is not my fuckin' problem, man!"
907,"You fucked her up, you fuckin' deal with this!"
908,"Uh, are you talkin' to me on a cellular phone?"
909,I don't know you. Who is this?
910,Don't come here!
911,I'm hanging up the phone!
912,Prank caller! Prank caller!
913,"TIRES SCREECHING, ENGINE RACING LOUD CRASH JODY What the hell was that?"
914,Have you lost your fucking mind?
915,You were talking about drug shit on a cellular phone!
916,"Lance, help me."
917,You crashed your car into my fucking house!
918,Grab her feet.
919,Are you deaf?
920,You are not bringing this fuckedup bitch into my house!
921,"This ""fuckedup bitch"" is Marsellus Wallace's wife."
922,Do you know who Marsellus Wallace is?
923,Yeah.
924,"If she croaks on me, I am a fucking grease spot!"
925,Now look: I am I will be forced to tell him that you did not help and and that let her die on your lawn.
926,"Now, come on, help me, help me."
927,Pick her up.
928,Shit.
929,GRUNTS Lance!
930,Shit.
931,It's 1:30 in the goddamn morning.
932,What the fuck's going on out here?
933,Who's she?
934,Go to the fridge and get the thing with the adrenaline shot.
935,What's wrong with her?
936,She's O.D.ing!
937,Get her the hell outta here!
938,TOGETHER Get the shot!
939,Fuck you!
940,Fuck you too!
941,What a fuckin' bitch.
942,"Just keep talking to her, all right?"
943,She's gettin' the shot.
944,I'm going to go get my little black medical book.
945,What the fuck you need a medical book for?
946,I've never had to give an adrenaline shot before!
947,You've never given an adrenaline shot?!
948,I don't go joypoppin' with bubblegummers!
949,My friends can handle their highs!
950,Get the shot!
951,"I am, if you'll let me!"
952,I ain't fucking stopping you!
953,Stop talking to me.
954,Start talking to her!
955,Get the shot!
956,All right!
957,"VINCENT Hurry up, Lance, we're losing her!"
958,I'm looking as fast as I can!
959,JODY What's he looking for?
960,VINCENT I don't know.
961,Some book.
962,JODY What are you looking for?
963,A little black medical book.
964,What are you looking for?
965,My little black medical book!
966,It's like a textbook they give to nurses.
967,I never saw no medical book.
968,Trust me. I have one.
969,"If it's so important, why don't you keep it with the shot?"
970,I don't know!
971,Stop bothering me!
972,"While you're looking, that girl's gonna die on our carpet."
973,You're never gonna find anything in this mess!
974,I'm gonna fucking kill you if you don't shut up!
975,"VINCENT YELLING Lance, get in here!"
976,Right?
977,Get the fuck outta my way.
978,Pig.
979,Quit fuckin' around and give her the shot.
980,"Look, while I'm doing this, you take off her shirt and find her heart."
981,Does it gotta be exact?
982,"Yes it's gotta be exact. We're giving her a shot in the heart, so I guess it's gotta be fucking exact."
983,I don't know exactly where her heart is. I think it's right here.
984,That's it.
985,"All right, what I need is a big, fat magic marker."
986,You got it?
987,What?
988,A magic marker.
989,A felt pen!
990,A fuckin' black magic marker!
991,Christ.
992,"Come on, man. Hurry up!"
993,"Fuck! Okay, okay."
994,Okay. I think it's ready.
995,"Hurry up, man."
996,I'll tell you what to do.
997,"No no no man, I ain't giving you're gonna give her the shot."
998,"No, you're gonna give her the shot."
999,I ain't giving her the shot.
1000,I never done this before.
1001,I ain't never done this either!
1002,"I ain't starting now! Look, you brought her here and that means that you're gonna give her the shot."
1003,"The day I bring an O.D.ing bitch to your house, then I give her the shot."
1004,Give her the shot.
1005,Give it to me.
1006,Here.
1007,Give me that.
1008,"All right, all right tell me what to do."
1009,"Okay, uh you're giving her an injection of adrenaline straight to her heart."
1010,But she's got a breastplate    you gotta pierce through that.
1011,"THUMPING So what you gotta do is, you gotta bring the needle down in a stabbing motion."
1012,I gotta    I gotta stab her three times?
1013,"No, you don't gotta fucking stab her three times. You gotta stab her once!"
1014,"But it's gotta be hard enough to get through her breastplate into her heart, alright?"
1015,"And then once you do that, you ppress down on th, the pplunger."
1016,Okay. Then what happens?
1017,Kinda curious about that myself.
1018,This ain't no fuckin' joke!
1019,Am I gonna kill her?
1020,"She's supposed to come out of it like that. It's    All right, count to three."
1021,All right. Ready?
1022,One.
1023,VINCENT PANTING Two.
1024,Three!
1025,"LOUD THUMP GASPS, SCREAMS GASPING CONTINUES COUGHS, GASPS, CRYING If you're all right, then say something."
1026,Something.
1027,CHUCKLES That was fuckin' trippy.
1028,CHUCKLES Ohh.
1029,"Oh, man."
1030,"CAR PULLS UP DOOR OPENS, CLOSES ENGINE STOPS DOOR OPENS, CLOSES Mia. Mia."
1031,What's    What's your thoughts on    on    on how to handle this?
1032,What's yours?
1033,"Well, I'm of the opinion that if Marsellus lived his whole life, he doesn't need know nothing about this incident."
1034,"If Marsellus knew about this incident, I'd be in as much trouble as you."
1035,I seriously doubt that.
1036,I can keep a secret if you can.
1037,Shake on it?
1038,Mum's the word?
1039,Cool.
1040,"Now, if you'll excuse me, I'm going to go home and have a heart attack."
1041,Vincent.
1042,"Do you wanna hear my ""Fox Force Five"" joke?"
1043,Sure.
1044,Except I think I'm still a little too petrified to laugh.
1045,"No, you won't laugh 'cause it's not funny."
1046,"But if you still wanna hear it, I'll tell it."
1047,I can't wait.
1048,Okay.
1049,Three tomatoes are walkin' down the street.
1050,"Papa Tomato, Mama Tomato and Baby Tomato."
1051,"Baby Tomato starts lagging behind, and Papa Tomato gets really angry."
1052,"Goes back and squishes him, and says, ""Ketchup."" WEAK CHUCKLE Ketchup."
1053,See you around.
1054,"DOG BARKING VOICE ON TELEVISION Oh, that paddlefoot. He funny, silly dog."
1055,He think totem pole alive!
1056,GIGGLING VOICE CONTINUES He Arctic tenderfoot!
1057,LAUGHING That totem pole been here forever!
1058,WOMAN Butch?
1059,"PADDLEFOOT BARKING MAN ON TELEVISION One more thing, and we'll start for    Butch, stop watching TV for a second."
1060,Yeah?
1061,You've got a special visitor.
1062,MAN ON TELEVISION Stand up.
1063,Stand up.
1064,"Now, do you remember when I told you your daddy died in a P.O.W. camp?"
1065,"Well, this here is Captain Koons."
1066,He was in the P.O.W. camp with Daddy.
1067,"Hello, little man."
1068,"Boy, I sure heard a bunch about you."
1069,"See, I was a good friend of your dad's."
1070,We were in that Hanoi pit of hell together...
1071,over five years.
1072,Hopefully...
1073,"you'll never have to experience this yourself, but when two men are in a situation like me and your dad were..."
1074,"for as long as we were, you take on certain responsibilities of the other."
1075,"If it'd been me who'd    not made it, Major Coolidge'd be talking right now to my son Jim."
1076,"But the way it turned out, I'm talking to you."
1077,Butch...
1078,I got something for ya.
1079,This watch I got here...
1080,was first purchased by your greatgrandfather during the First World War.
1081,"It was bought in a little general store in Knoxville, Tennessee."
1082,Made by the first company to ever make wristwatches.
1083,"Up 'til then, people just carried pocket watches."
1084,It was bought by Private Doughboy Erine Coolidge...
1085,on the day he set sail for Paris.
1086,"This was your greatgrandfather's war watch, and he wore it every day he was in that war, and..."
1087,"when he'd done his duty, he went home to your greatgrandmother, took the watch off, put it in an old coffee can, and in that can it stayed..."
1088,"until your granddad, Dane Coolidge, was called upon by his country..."
1089,to go overseas and fight the Germans once again.
1090,This time they called it World War II.
1091,Your greatgrandfather gave this watch to your granddad for good luck.
1092,"Unfortunately, Dane's luck wasn't as good as his old man's."
1093,"Dane was a Marine, and he was killed, along with all the other Marines at the battle of Wake Island."
1094,Your granddad was facing death.
1095,He knew it.
1096,"None of those boys had any illusions about ever leaving that island alive, so three days before the Japanese took the island, your granddad asked a gunner on an Air Force transport, name of Winocki    a man he'd never met before in his life    to deliver to his infant son, who he'd never seen in the flesh, his gold watch."
1097,"Three days later, your granddad was dead, but Winocki kept his word."
1098,"After the war was over, he paid a visit to your grandmother, delivering to your infant father his dad's gold watch."
1099,This watch.
1100,This watch was on your daddy's wrist when he was shot down over Hanoi.
1101,"He was captured, put in a Vietnamese prison camp."
1102,"He knew if the gooks ever saw the watch, it'd be confiscated, taken away."
1103,"The way your dad looked at it, this watch was your birthright."
1104,"He'd be damned if any slope's gonna put their greasy, yellow hands on his boy's birthright, so he hid it in one place he knew he could hide something    his ass."
1105,Five long years he wore this watch up his ass.
1106,Then he died of dysentery    He give me the watch.
1107,"I hid this uncomfortable hunk of metal up my ass, two years."
1108,Then...
1109,"after seven years, I was sent home to my family and..."
1110,now...
1111,"little man, I give the watch to you."
1112,"BELL RINGS GASPS CROWD CHEERING GRUNTING CHEERING CONTINUES It's time, Butch."
1113,"EXHALING RING ANNOUNCER In the lightweight division, in the right corner wearing the blue trunks, BUTCH GRUNTS weighing 210 pounds, Floyd Ray Wilson!"
1114,"CROWD CHEERING, YELLING BELL RINGS ANNOUNCER It's official. It's official."
1115,Wilson is dead!
1116,"ANNOUNCER 2 Well, Dan, that had to be the bloodiest..."
1117,"hands down, the most brutal fight this city's ever seen."
1118,Coolidge was out of there faster than I've ever seen a victorious boxer leave the ring.
1119,ANNOUNCER 1 Do you think he knew Wilson was dead?
1120,ANNOUNCER 2 My guess would be yes.
1121,I could see the frenzy in his eyes give way to the realization of what he was doing.
1122,I think any man would've left the ring that fast.
1123,Do you feel this tragedy...
1124,is gonna affect the world of boxing?
1125,A tragedy like this can't help but shake the world of boxing to its very foundations.
1126,"It's of paramount importance, during the sad weeks ahead, the eyes of the W.B.A. remain    CROWD CHEERING, YELLING CONTINUES ENGINE STARTS TIRES SCREECHING HORN HONKING MAN Man, you know I didn't    Marsellus."
1127,"No, it wasn't."
1128,I didn't do it.
1129,I didn't do it.
1130,How you doing?
1131,Great.
1132,I never thanked you for dinner.
1133,What you got?
1134,He booked.
1135,His trainer?
1136,Says he don't know nothin'.
1137,I believe him.
1138,I think Butch surprised his ass same as us.
1139,"No, we don't wanna ""think."" We wanna know."
1140,"Take him to the kennel, sic the dogs on his ass."
1141,We'll find out for goddamn sure what he knows and what he don't.
1142,Butch's search    how do you want it done?
