,dialog
1143,I'm prepared to scour the Earth for that motherfucker.
1144,"If Butch goes to Indochina, I want a nigger hiding in a bowl of rice..."
1145,ready to pop a cap in his ass.
1146,I will take care of it.
1147,Mister.
1148,"Hey, mister."
1149,What?
1150,"You were in that fight, the fight on the radio."
1151,You're the fighter?
1152,Whatever gave you that idea?
1153,"No, come on."
1154,You're him.
1155,I know you're him.
1156,Tell me you're him.
1157,I'm him.
1158,You killed the other boxing man.
1159,He's dead?
1160,The radio said he was dead.
1161,"Sorry about that, Floyd."
1162,What does it feel like?
1163,What does what feel like?
1164,Killing a man.
1165,Beating another man to death with your bare hands.
1166,"What are you, a weirdo?"
1167,No.
1168,It is a subject I have much interest in.
1169,You are the first person I have ever met who has killed somebody.
1170,So?
1171,What does it feel like to kill a man?
1172,BUTCH SNIFFS I'll tell you what.
1173,Give me one of them cigarettes you got up there and I'll tell you all about it.
1174,"So, Esmarelda..."
1175,Villa Lobos    is that Mexican?
1176,"The name is Spanish, but I am Colombian."
1177,"That's some handle you got there, honey."
1178,Thank you.
1179,And what is your name?
1180,Butch.
1181,Butch. What does it mean?
1182,"I'm an American, honey."
1183,Our names don't mean shit.
1184,"So, moving right along, Esmarelda, what is it you want to know?"
1185,I want to know what it feels like to kill a man.
1186,I couldn't tell ya.
1187,I didn't know he was dead 'til you told me he was dead.
1188,"Now that I know he's dead, you wanna know how I feel about it?"
1189,I don't feel the least bit bad about it.
1190,What the fuck'd I tell ya?
1191,Huh?
1192,"As soon as the word got out the fix was in, man, the odds went through the roof."
1193,I know. I know.
1194,Unbelievable.
1195,"Hey, fuck him, Scotty."
1196,"If he was a better boxer, he'd still be alive."
1197,"If he never laced up his gloves, which he never shoulda done in the first fuckin' place, he'd still be alive."
1198,"HAWKS, SPITS Yeah, well, who gives a fuck?"
1199,It's over now.
1200,"Yeah, well, enough about the poor, unfortunate Mr. Floyd."
1201,Let's talk about the rich and prosperous Mr. Butch.
1202,How many bookies did you lay it around on?
1203,All eight?
1204,How long to collect?
1205,So you'll have it all by tomorrow night?
1206,"No, I understand."
1207,A few stragglers aside.
1208,"Oh, fuck, Scotty, that is good news."
1209,"That is great news, man."
1210,"Yeah. Mmhmm. No, me and Fabienne are gonna leave in the morning."
1211,It'll probably take us a couple days to get down to Knoxville.
1212,"Okay, my brother."
1213,LAUGHING You're right.
1214,You're goddamn right.
1215,"All right, Scotty, next time I see you, it'll be on Tennessee time."
1216,"Cool, brother."
1217,$45.60.
1218,"And, uh, here's a little something for the effort. Now..."
1219,"if anybody asks you who your fare was tonight, what are you gonna say?"
1220,The truth.
1221,"Three welldressed, slightly toasted Mexicans."
1222,"Bonsoir, Esmarelda Villa Lobos."
1223,"Buenas noches, Butch."
1224,Whew.
1225,Keep the light off.
1226,"Is that better, sugar pop?"
1227,Oui.
1228,SIREN WAILING IN DISTANCE DOG BARKING Hard day at the office?
1229,Pretty hard.
1230,Got in a fight.
1231,Poor baby.
1232,Can you make spoons?
1233,You know what?
1234,I was thinkin' about takin' a shower.
1235,I'm stinkin' like a dog over here.
1236,I like the way you stink.
1237,Let me take this jacket off.
1238,I was looking at myself in the mirror.
1239,Uhhuh.
1240,I wish I had a pot.
1241,You were looking at yourself in the mirror and you wish you had some pot?
1242,A pot. GIGGLES A pot belly.
1243,Pot bellies are sexy.
1244,"Well, you should be happy    GRUNTS 'cause you have one."
1245,"Shut up, fatso."
1246,I don't have a pot.
1247,"I have a bit of a tummy, like Madonna when she did ""Lucky Star."" It's not the same thing."
1248,I didn't know there was such a difference between a pot belly and a tummy.
1249,The difference is huge.
1250,KISSING Would you like it if I had a pot belly?
1251,No.
1252,Pot bellies make a man look either oafish or like a gorilla.
1253,But on a woman a pot belly's very sexy.
1254,"The rest of you is normal    normal face, normal legs, normal hips, normal ass    but with a big, perfectly round pot belly."
1255,"If I had one, I'd wear a Tshirt two sizes too small..."
1256,to accentuate it.
1257,You think men would find that attractive?
1258,I don't give a damn what men find attractive.
1259,It's unfortunate what we find pleasing to the touch and pleasing to the eye...
1260,is seldom the same.
1261,"SIGHS If you had a pot belly, I would punch you in it."
1262,You'd punch me in the belly?
1263,Right in the belly.
1264,Ohh! I'd smother you!
1265,I'd drop it right on your face 'til you couldn't breathe!
1266,LAUGHING You'd do that?
1267,Yeah.
1268,Promise?
1269,Yeah.
1270,MOANING SOFTLY Mmm. Mmm.
1271,Mmm.
1272,"MOANING, LAUGHING Oh."
1273,INHALING GRUNTING Did you get everything?
1274,"Yes, I did."
1275,"Good job, Sugar Pop."
1276,Did everything go as planned?
1277,You didn't listen to the    Ow!
1278,GIGGLES You didn't listen to the radio?
1279,I never listen to your fights.
1280,Were you the winner?
1281,"I won, all right."
1282,Are you still retiring?
1283,Sure am.
1284,So it all worked out in the finish.
1285,"We're not at the finish yet, baby."
1286,"MOANING We're in a lot of danger, aren't we?"
1287,"If they find us, they'll kill us, won't they?"
1288,"But they won't find us, will they?"
1289,Do you still want me to go with you?
1290,I don't want to be a burden or a nuisance. It's    MOANS Say it.
1291,"MOANS Fabienne, I want you to be with me."
1292,Forever?
1293,Forever and ever.
1294,Do you love me?
1295,"Very, very much."
1296,MOANING Butch.
1297,Yes?
1298,Will you give me oral pleasure?
1299,Will you kiss it?
1300,But you first.
1301,Okay.
1302,Okay.
1303,MOANS Butch.
1304,Mon amour.
1305,L'aventure commence.
1306,MOANING CONTINUES SHOWER WATER RUNNING BUTCH GRUNTING BUTCH I think I cracked a rib.
1307,Giving me oral pleasure?
1308,"No, retard, from the fight."
1309,"Don't call me ""retard."" SLURRED VOICE My name is Fabby."
1310,My name is Fabienne!
1311,Stop it.
1312,Stop it!
1313,"My name is Fabi    Shut up, fuckhead!"
1314,I hate that mongoloid voice.
1315,"Okay, okay."
1316,"Sorry, sorry, sorry."
1317,WATER STOPS BUTCH I take it back.
1318,"Will you hand me a dry towel, Miss Beautiful Tulip?"
1319,"Oh, I like that."
1320,I like being called a tulip.
1321,"COUGHS ""Tulip"" is much better than ""mongoloid."" I didn't call you a mongoloid."
1322,I called you a retard.
1323,And I took it back.
1324,GRUNTS Butch?
1325,"Yes, lemon pie?"
1326,Where are we going to go?
1327,"Well, I'm not sure yet."
1328,Wherever you want.
1329,"We're gonna get a lot of money from this, but it ain't gonna be the kind of money..."
1330,that we can live like hogs in the fathouse forever.
1331,I was thinking maybe we could go down someplace in the South Pacific.
1332,Kind of money we're gonna have's gonna carry us a long way down there.
1333,"If we wanted, we could live in Bora Bora?"
1334,You betcha.
1335,"And if after a while you didn't dig that, we could go someplace else."
1336,"Maybe Tahiti, Mexico."
1337,But I do not speak Spanish.
1338,"Well, you do not speak BoraBoran either."
1339,"Besides, Mexican's easy."
1340,   Donde esta el zapater  a?
1341,What does that mean?
1342,Where is the shoe store?
1343,"   Donde esta    Spit, please."
1344,SPITS    Donde esta el zapater  a?
1345,Excellent pronunciation.
1346,Mmm.
1347,GIGGLES You'll be my little mamacita in no time.
1348,YAWNING    Que hora es?
1349,   Que hora es?
1350,What time is it?
1351,What time is it?
1352,Time for bed.
1353,"Sweet dreams, jellybean."
1354,SPITS Butch?
1355,Never mind.
1356,"BRUSHING MOTORBIKE ENGINES RACING, EXPLOSIONS ON TELEVISION Aah!"
1357,PANTING Merde! You startled me.
1358,Did you have a bad dream?
1359,"YAWNS, SCOFFS MOTORCYCLE ENGINES, EXPLOSIONS CONTINUE PANTING CONTINUES What is this you're watching?"
1360,A motorcycle movie.
1361,I'm not sure the name.
1362,Are you watching it?
1363,In a way.
1364,It's a little early in the morning for explosions and war.
1365,What was it about?
1366,"How should I know, Fabienne?"
1367,You were the one who was watching it.
1368,"No, imbecile, what was your dream about?"
1369,I don't know.
1370,I don't remember.
1371,It's really rare that I remember my dreams.
1372,"Well, let's look at the grumpy man in the morning."
1373,BOTH MOANING FABIENNE Why don't you get up and we'll get some breakfast.
1374,BUTCH One more kiss and I'll get up.
1375,MOANS Satisfied?
1376,EXHALING Yep.
1377,"GRUNTS Get up, lazy bones!"
1378,Ohh!
1379,Ohh. God.
1380,GIGGLES What time is it?
1381,Almost nine in the morning.
1382,What time does our train arrive?
1383,Eleven.
1384,You know what I'm gonna have for breakfast?
1385,"What, Lemon Pie?"
1386,I'm gonna order a big plate of blueberry pancakes...
1387,"with maple syrup, eggs over easy and five sausages."
1388,Anything to drink with that?
1389,"Wow, that looks nice."
1390,GIGGLES To drink    a tall glass of orange juice...
1391,and a black cup of coffee.
1392,"After that, I'm going to have a slice of pie."
1393,Pie for breakfast?
1394,LAUGHING Any time of the day is a good time for pie.
1395,Blueberry pie to go with the pancakes.
1396,"And on top, a thin slice of melted cheese."
1397,Where's my watch?
1398,It's there.
1399,"No, it's not."
1400,Have you looked?
1401,"Yes, I've fuckin' looked."
1402,What the fuck do you think I'm doin'?
1403,You sure you got it?
1404,Yes.
1405,Bedside table drawer.
1406,On the little kangaroo?
1407,"Yes, it was on the little kangaroo."
1408,"Yeah, well, it's not here now."
1409,"BUTCH RUMMAGING Well, it should be."
1410,"Yes, it most definitely should be, but it's not here now!"
1411,So where the fuck is it?
1412,"Fabienne, it was my father's fucking watch."
1413,Do you have any idea what he had to go through to get me that watch?
1414,"I don't have time to go into it, but he went through a lot."
1415,"Now all this other shit you could've set on fire, but I specifically reminded you..."
1416,not to forget the fucking watch!
1417,Now think.
1418,Did you get it?
1419,I believe so.
1420,"""You believe so""?"
1421,What the fuck does that mean?
1422,You either did or didn't get it.
1423,Then I did.
1424,Are you sure?
1425,No.
1426,Fuck! Fuck! Fuck!
1427,Motherfucker!
1428,Motherfuckin'    SCREAMING CRASH Do you know how fucking stupid you fucking are?
1429,No!
1430,GRUNTS It's not your fault.
1431,You left it at the apartment.
1432,"If you left it at the apartment, it's not your fault."
1433,I had you bring a bunch of stuff.
1434,"EXHALING I reminded you about it, but I didn't illustrate how personal the watch was to me."
1435,"If all I gave a fuck about was the watch, I shoulda told you that."
1436,You're not a mind reader.
1437,Are you?
1438,SNIFFLING I    I'm sorry.
1439,Don't be.
1440,Just means I can't have breakfast with you.
1441,Why does it mean that?
1442,Because I gotta go back to my apartment and get my watch.
1443,Won't the gangsters be looking for you there?
1444,"Well, that's what I'm gonna find out."
1445,"If they are, and I don't think I can handle it, then I'll split."
1446,I saw your watch.
1447,I thought I brought it.
1448,I'm so sorry.
1449,Here's some money.
1450,Go out and get those pancakes.
1451,Have a nice breakfast.
1452,I'll take your Honda.
1453,"I'll be back before you can say ""blueberry pie."" Blueberry pie."
1454,Maybe not that fast.
1455,But pretty fast. Okay?
1456,Okay.
1457,Bye.
1458,Bye.
1459,"Shit! Of all the fuckin' things she could fuckin' forget, she forgets my father's watch!"
1460,"I specifically reminded her    Bedside table, on the kangaroo."
1461,"I said the words: ""Don't forget my father's watch."" TIRES SCREECHING ENGINE STOPS RADIO ANNOUNCER Visit the Jackrabbit Slim's nearest you..."
1462,"       CAR HORN PLAYING ""LA CUCARACHA"" RADIO ANNOUNCER   El burro!"
1463,"       ICE CREAM TRUCK BELLS CHILDREN PLAYING, CRYING WOMAN, CHILDREN TALKING GIRL TALKING DOG BARKING WOMAN CONTINUES TALKING Lookin' good, Butch."
1464,"TOILET FLUSHES GUN SHOTS, CRASH, GLASS SHATTERING SMOKE ALARM BEEPING BEEPING CONTINUES BEEPING CONTINUES, FAINT BABY TALKING ENGINE STARTS        RADIO: ""FLOWERS ON THE WALL""     If I were walkin' in your shoes            CONTINUES     Countin' flowers on the wall That don't bother me at all         Playin' solitaire 'til dawn with a deck of 51     That's how you're gonna beat 'em, Butch."
1465,    Smokin' cigarettes and watchin' Captain Kangaroo     They keep underestimatin' ya.
1466,    Now don't tell me     SINGING ALONG     Countin' flowers on the wall         That don't bother me at all         Playin' solitaire 'til dawn with a deck of 51         Smokin' cigarettes and watchin' Captain Kangaroo         Now don't tell me         I've nothin' to do         It's good to see you I must go         I know I look a fright         Anyway my eyes     MARSELLUS Motherfucker.
1467,    Are not accustomed        Uhh!
1468,TIRES SCREECHING WOMAN Do you think he's dead?
1469,He's dead.
1470,"Oh, my God."
1471,He's dead.
1472,"If you need someone to go to court, I'll be glad to help."
1473,That guy was a drunken maniac.
1474,"He hit you, then he crashed into that car."
1475,Who?
1476,Him.
1477,I'll be damned.
1478,"WOMEN SCREAMING GRUNTING, PANTING GUNSHOT Ohh!"
1479,WOMAN SCREAMING Aaaah! I'm shot!
1480,"GRUNTING SCREAMING CONTINUES GRUNTING, GROANING GRUNTS GUNSHOT MAN Sally! Sally!"
1481,GRUNTING CONTINUES PANTING GUNSHOT Aaah!
1482,"       RADIO: WHISTLING MARSELLUS, MUFFLED Motherfucker!"
1483,DOOR BELLS JINGLING PANTING Can I help you with somethin'?
1484,Shut the fuck up.
1485,"Now you just wait a goddamn minute, now!"
1486,What the fuck you up to?
1487,"Come here, motherfucker!"
1488,"BOTH GRUNTING, GROANING MARSELLUS GROANING You feel that sting, huh, big boy?"
1489,"That's pride fuckin' with you, see?"
1490,You gotta fight through that shit!
1491,GRUNTING Huh?
1492,"You'd better kill me    Yeah, somebody's gonna get killed."
1493,"Somebody's gonna get their motherfuckin' head blown to    SHOTGUN COCKS Hold it right there, goddamn it."
1494,"This ain't none of your business, mister."
1495,I'm makin' it my business.
1496,Toss the weapon.
1497,"You don't understand, man."
1498,Toss the weapon.
1499,PANTING WOMAN ON RADIO     It's time         To find love     Take your foot off the nigger.
1500,"       CONTINUES Put your hand behind your head, approach the counter right now."
1501,This motherfucker's trying to...
1502,GROANS kill me.
1503,Shut up.
1504,Keep comin'.
1505,Come on.
1506,    If love         Is shelter     ROTARY DIALING        RADIO: WHISTLING Zed. Maynard.
1507,"Yeah, the spider just caught a couple flies."
1508,"    Whoa, my angel     RECEIVER HANGS UP     Down to you        BOTH GRUNTING, GROANING COUGHING GAGGING Nobody kills anybody in my place of business..."
1509,except me or Zed.
1510,DOORBELL CHIMES That's Zed.
1511,DOOR BELLS JINGLING ZED I thought you said you waited for me.
1512,MAYNARD I did.
1513,FOOTSTEPS DESCENDING STAIRS ZED Then how come they're all beat up?
1514,"They did that to each other, man."
1515,They came in fightin'.
1516,"Now, this 'un right here, he was gonna shoot that one."
1517,Is that right?
1518,"You gonna shoot him, boy?"
1519,Huh?
1520,"Hey, is Grace all right out front?"
1521,"Yeah. It ain't Tuesday, is it?"
1522,"No, it's Thursday."
1523,She oughta be fine.
1524,Mmm.
1525,"SIGHS Well, bring out the gimp."
1526,I think the gimp's sleepin'.
1527,"Then I guess you'll just have to go wake him up now, won't you?"
1528,Get up.
1529,Get down.
1530,TAPPING FINGERS Which one of 'em you wanna do first?
1531,TAPPING FINGERS ZED I ain't for sure yet.
1532,"WHISPERING Eeniemeenieminiemo, catch a nigger..."
1533,by his toe.
1534,"If he hollers, let him go."
1535,Eeniemeenieminiemo.
1536,My mother said...
1537,"pick the perfect one, and... you... are..."
1538,it.
1539,"ZED Guess that means you, big boy."
1540,MUFFLED Fuck you!
1541,MUFFLED MUMBLING Shh.
1542,You wanna do it in here?
1543,"No, let's take him back to Russell's old room."
1544,Sounds good to me.
1545,MUFFLED YELLING GRUNTING You keep an eye on this 'un.
1546,"SNIFFS        RADIO: ""COMANCHE"" BY THE REVELS ZED, MAYNARD TALKING, YELLING GRUNTING TALKING, YELLING CONTINUE LOUD, RHYTHMIC GRUNTING GIGGLING GRUNTING CONTINUES Yeah!"
1547,"GRUNTING, STRAINING ZED SHOUTING Now! Go! Come on, motherfucker!"
1548,"Now, motherfucker!"
1549,Aaah! GRUNTING GIGGLING CONTINUES SLAPPING ZED SHOUTING Come on! Yeah!
1550,       CONTINUES MUFFLED YELLING GRUNTING CONTINUES ZED Yeah!
1551,"SLAPPING, GRUNTING CONTINUE Ohh!"
1552,Yeah!
1553,"       CONTINUES, FAINT ZED, FAINT Yeah! Yeah!"
1554,Yeee! Yeeeehah!
1555,"YELLING CONTINUES DOOR BELLS JINGLING LOUD GRUNT, YELLING GRUNTING, YELLING CONTINUE ZED Yeah!"
1556,"YELLING CONTINUES LOUD, RHYTHMIC GRUNTING CONTINUES Come on!"
1557,Get down there!
1558,Aaah!
1559,Do it! Yeah!
1560,"       CONTINUES, LOUDER ZED SHOUTING Yeah! Yeah!"
1561,"YELLING CONTINUES MARSELLUS SCREAMING, MUFFLED MAYNARD Shut the fuck up!"
1562,SCREAMING CONTINUES MAYNARD Fuck him!
1563,ZED Come on!
1564,"MARSELLUS GROANING, MUFFLED Fuck him. Yeah."
1565,"CONTINUES YELLING, STOPS Aaaaah!"
1566,GROANING Aaaaah!
1567,"       FINISHES GROANS GROANS THUD You want that gun, don't ya, Zed?"
1568,Huh?
1569,Go ahead and pick it up.
1570,"Go ahead, pick it up."
1571,BREATHING HEAVILY Come on    Thatta boy!
1572,"I want you to pick it up, Zed."
1573,"SHOTGUN COCKING BREATHING SLOWLY Step aside, Butch."
1574,ZED WHEEZING Fuck!
1575,GROANING You okay?
1576,"GROANING CONTINUES No, man."
1577,I'm pretty fuckin' far from okay.
1578,"ZED SCREAMS LOUD, HIGHPITCHED SCREAM GROANING CONTINUES What now?"
1579,"""What now""?"
1580,Let me tell you what now.
1581,"GROANING, COUGHING I'm gonna call a couple of hard, pipehittin' niggers..."
1582,to go to work on the homes here...
1583,with a pair of pliers and a blowtorch.
1584,"You hear me talkin', hillbilly boy?"
1585,I ain't through with you by a damn sight!
1586,I'm gonna get medieval on your ass.
1587,I meant what now between me and you.
1588,"Oh, that ""what now."" I tell you what now between me and you."
1589,"WHEEZING There is no ""me and you""."
1590,Not no more.
1591,"GROANING, COUGHING So, are we cool?"
1592,"Yeah, we cool."
1593,LOUD GROAN Two things.
1594,Don't tell nobody about this.
1595,"This shit is between me, you..."
1596,"and Mr. ""Soontobelivin' therestofhisshortass lifeinagonizingpain""..."
1597,rapist here.
1598,It ain't nobody else's business.
1599,Two    You leave town tonight.
1600,Right now.
1601,"And when you gone, you stay gone, or you be gone."
1602,"LOUD GROAN, COUGHING You lost all your L.A."
1603,privileges. Deal?
1604,Deal.
1605,Get your ass outta here.
1606,"ZED WHEEZING GROANING GROANING CONTINUES Oh, shit."
1607,DOOR BELLS JINGLING ENGINE STARTS ENGINE STOPS Fabienne!
1608,GROANS Fabienne!
1609,GROANING CONTINUES Fabienne!
1610,"Come on, baby."
1611,Come on. Get your shit.
1612,We gotta go right now.
1613,I was so worried.
1614,What about our bags?
1615,"Fuck the bags; if we don't split right now, we'll miss the train."
1616,I'll be downstairs.
1617,Is everything well?
1618,Just come on!
1619,No talking now!
1620,Are we in danger?
1621,"GROANING CONTINUES Come on, honey!"
1622,Where did you get this motorcycle?
1623,"It's not a motorcycle, baby."
1624,It's a chopper. Let's go.
1625,What happened to my Honda?
1626,"I'm sorry, baby, I had to crash that Honda."
1627,"Will you come on now, please?"
1628,"Come on, let's go, let's go, let's go."
1629,You're hurt?
1630,"No, no, I might've broken my nose. It's no biggie."
1631,Come on. Hop on.
1632,"Baby, please, we    Honey, we gotta hit the fuckin' road! Get on!"
1633,"Oh, baby, I'm sorry."
1634,"Come here, come here."
1635,WEEPING QUIETLY I'm sorry. Mmm.
1636,I'm so sorry.
1637,"You were gone so long, I started to think dreadful thoughts."
1638,I didn't mean to worry you.
1639,Everything's fine.
1640,How was your breakfast?
1641,It was good.
1642,Did you get the blueberry pancakes?
1643,They didn't have blueberry; I had to get buttermilk.
1644,Are you sure you're okay?
1645,"Since I left you, this has been, without a doubt, the single weirdest fuckin' day of my life    I'll tell you all about it."
1646,Gotta go. Come on.
1647,"Butch, whose motorcycle is this?"
1648,"It's a chopper, baby."
1649,Whose chopper is this?
1650,Zed's.
1651,Who's Zed?
1652,"Zed's dead, baby."
1653,Zed's dead.
1654,"ENGINE STARTS JULES Yes, you did, Brett!"
1655,"You tried to fuck him, and Marsellus Wallace don't liked to be fucked..."
1656,by anybody except Mrs. Wallace.
1657,"PANTING BRETT Oh, God, please, I don't wanna die."
1658,"You read the Bible, Brett?"
1659,WHIMPERING Yes!
1660,"Well, there's this passage I got memorized."
1661,Sorta fits the occasion.
1662,Ezekiel 25:17.
1663,"""The path of the righteous man is beset on all sides..."
1664,"""by the inequities of the selfish..."
1665,"""and the tyranny of evil men."
1666,"WHIMPERING CONTINUES ""Blessed is he who, in the name of charity and good will, ""shepherds the weak through the valley of darkness, ""for he is truly his brother's keeper..."
1667,"""and the finder of lost children."
1668,"""And I will strike down upon thee with great vengeance..."
1669,"""and furious anger..."
1670,"""those who attempt to poison and destroy my brothers."
1671,"""And you will know my name is the Lord..."
1672,"when I lay my vengeance upon thee."" GROANS LOUDLY GUNSHOTS SCREAMS I'm fucked."
1673,"Oh, fuck. Oh, fuck."
1674,VINCENT Is he a friend of yours?
1675,"Oh, goddamn. Goddamn."
1676,"JULES Hmm? Oh. Vincent, Marvin."
1677,"Marvin, Vincent."
1678,Better tell him to shut up.
1679,He's gettin' on my nerves.
1680,Fuck. MUTTERING JULES Marvin...
1681,Marvin. Marvin!
1682,I'd knock that shit off if I was you.
1683,"DOOR SLAMS Die, you motherfuckers! Die!"
1684,HAMMER CLICKING GUNSHOTS Why the fuck didn't you tell us somebody was in the bathroom?
1685,Slip your mind?
1686,Did you forget that someone was in there...
1687,with a goddamn hand cannon?
1688,You see the size of that gun he fired at us?
1689,It was bigger than him.
1690,"We should be fuckin' dead, man."
1691,I know.
1692,We was lucky.
1693,"No, no, no, no."
1694,That shit wasn't luck.
1695,"Yeah, maybe."
1696,This was divine intervention.
1697,You know what divine intervention is?
1698,I think so.
1699,That means that God came down from heaven and stopped the bullets.
1700,That's right.
1701,That's exactly what it means.
1702,God came down from heaven and stopped these motherfuckin' bullets.
1703,"I think it's time for us to leave, Jules."
1704,Don't do that.
1705,Don't fuckin' blow this shit off!
1706,What just happened here was a fuckin' miracle!
1707,Chill. This shit happens.
1708,"Wrong! Wrong. This shit doesn't ""just happen."" Do you want to continue this theological discussion in a car..."
1709,or in a jailhouse with the cops?
1710,"We should be fuckin' dead, my friend!"
1711,"What happened here was a miracle, and I want you to fucking acknowledge it!"
1712,"All right, it was a miracle."
1713,Can we go now?
1714,"Let's go, nigger!"
1715,Come on! Shit.
1716,VINCENT You ever seen that show Cops?
1717,"I was watching it one time and there was this cop on, and he was talkin' about this gunfight he had in the hallway with this guy, right?"
1718,He just unloaded on this guy and nothin' happened.
1719,He didn't hit nothin'.
1720,Okay? It was just him and this guy.
1721,"I mean, you know, it'sit's freaky, but it happens."
1722,"Look, you wanna play blind man, go walk with the shepherd, but me, my eyes are wide fuckin' open."
1723,What the fuck does that mean?
1724,It means that's it for me.
1725,"From here on in, you can consider my ass retired."
1726,Jesus Christ.
1727,Don't blaspheme.
1728,Goddamn it.
1729,"I said, don't do that!"
1730,Hey you know why are you fuckin' freakin' out on us?
1731,"Look, I'm tellin' Marsellus today    I'm through."
1732,Why don't you tell him at the same time why?
1733,"Don't worry, I will."
1734,"And I bet you $10,000 he laughs his ass off."
1735,I don't give a damn if he does.
1736,"SIGHS Marvin, what do you make of all this?"
1737,"Man, I don't even have an opinion."
1738,You gotta have an opinion.
1739,You think God came down from heaven and stopped    GUNSHOT Whoa! What the fuck's happenin'?
1740,"Aw, shit, man!"
1741,"Aw, man!"
1742,"Oh, man, I shot Marvin in the face."
1743,Why the fuck'd you do that?
1744,I didn't mean it.
1745,It was an accident.
1746,"Man, I seen some crazyass shit in my time, but this    Chill out, man!"
1747,It was an accident.
1748,We probably went over a bump or somethin'.
1749,The car ain't hit no motherfuckin' bump.
1750,I didn't mean to shoot the son of a bitch. The gun went off.
1751,Look at this fuckin' mess!
1752,We're on a city street in broad daylight here!
1753,I don't believe it!
1754,"Well, believe it now, motherfucker!"
1755,We gotta get this car off the road.
1756,Cops notice shit like a car drenched in blood.
1757,"Just take it to a friendly place, that's all!"
1758,"This is the Valley, Vincent."
1759,Marsellus ain't got no friendly places in the Valley.
1760,"Well, Jules, this ain't my fuckin' town, man!"
1761,Shit!
1762,What you doing?
1763,I'm calling my partner in Toluca Lake.
1764,Where's Toluca Lake?
1765,"Over the hill here, by Burbank Studios."
1766,"If Jimmie's ass ain't home, I don't know what the fuck we gonna do, 'cause I ain't got no other partners in 818."
1767,"Jimmie, how you doin', man?"
1768,"It's Jules. Just listen up, man."
1769,"Me and my homeboy are in a car, and we gotta get it off the road, pronto."
1770,I need to use your garage for a couple hours.
