number_of_dialog,start_time,end_time,dialog
1086,"01:12:53,795","01:12:55,422","Probably robbed some old lady, huh?"
1087,"01:13:07,225","01:13:09,519","OK, I know your kind, right?"
1088,"01:13:09,561","01:13:11,896",Bad-ass peckerwood with an attitude.
1089,"01:13:13,523","01:13:17,694","Let me tell you something, man, you better watch your ass..."
1090,"01:13:17,736","01:13:21,573","'cause in the joint, you the nigger, not me."
1091,"01:13:25,493","01:13:29,164",I was a year in. I thought I was cruising.
1092,"01:13:29,205","01:13:31,916",Then everything started getting complicated.
1093,"01:13:58,944","01:14:00,570",What the fuck is that?
1094,"01:14:02,030","01:14:03,281",What's that all about?
1095,"01:14:03,323","01:14:06,993","That's just politics, man. Favors, you know?"
1096,"01:14:08,578","01:14:11,498",He's doing favors for that fucking spic?
1097,"01:14:12,582","01:14:15,043",Mitch has just got a little something extra...
1098,"01:14:15,085","01:14:17,420","on the side with them boys, you know?"
1099,"01:14:17,462","01:14:19,673","You're kidding, right?"
1100,"01:14:19,714","01:14:21,841",No.
1101,"01:14:21,883","01:14:23,808","That's bullshit, man."
1102,"01:14:23,843","01:14:25,512",Somebody should say something to him.
1103,"01:14:25,553","01:14:27,180",What the fuck is he thinking?
1104,"01:14:27,222","01:14:30,100",Mitch is the only reason you're not a corpse right now.
1105,"01:14:30,141","01:14:32,560",You know what? I don't fucking give a shit.
1106,"01:14:32,602","01:14:34,813",I can take care of myself.
1107,"01:14:34,854","01:14:38,775","He shouldn't be doing that. I'm getting sick of it, man."
1108,"01:14:38,817","01:14:41,528",There's a lot of hard talk here and no follow-through.
1109,"01:14:44,239","01:14:48,118",I think you better chill out on the preaching bullshit.
1110,"01:14:48,159","01:14:50,578",We're getting a little tired of that shit around here.
1111,"01:14:50,620","01:14:54,165",Ease up on it.
1112,"01:15:24,112","01:15:25,447","What are you doing here, Doris?"
1113,"01:15:25,488","01:15:27,657",I was in the neighborhood.
1114,"01:15:27,699","01:15:30,452","Look, I told you I don't want you all coming up here."
1115,"01:15:30,493","01:15:33,663","I don't care what you told me, OK?"
1116,"01:15:33,705","01:15:34,998",I need to talk to you now.
1117,"01:15:55,602","01:15:57,103","So, how is everyone?"
1118,"01:15:57,145","01:16:02,108",Davina's great. She's getting straight As almost.
1119,"01:16:02,143","01:16:07,072","And Ally's walking, starting to talk a little."
1120,"01:16:12,118","01:16:13,244",How's Danny?
1121,"01:16:19,042","01:16:21,836",He holds you up so high.
1122,"01:16:21,878","01:16:25,173",He thinks you're the greatest.
1123,"01:16:25,215","01:16:28,343",He's always bragging about you to Cameron...
1124,"01:16:28,385","01:16:30,303",and all his new friends.
1125,"01:16:33,890","01:16:35,684",He's starting to remind me of you.
1126,"01:16:35,725","01:16:38,687","Jesus, don't sound so worried, all right?"
1127,"01:16:38,728","01:16:42,774","I'm sure he's fine. He's 16 years old, Doris."
1128,"01:16:42,816","01:16:44,567",He's not gonna be a little angel forever.
1129,"01:16:44,609","01:16:47,070",You think because I watched my firstborn...
1130,"01:16:47,112","01:16:49,739",fuck up his entire life that I can sit here...
1131,"01:16:49,781","01:16:53,201",and see my baby follow him down the same toilet?
1132,"01:16:53,243","01:16:54,953",I can't fix all this shit from up here.
1133,"01:16:54,995","01:16:56,913",I'm not asking you to.
1134,"01:16:56,955","01:17:00,292",All it does is make me feel bad. You're just making it harder.
1135,"01:17:00,333","01:17:03,878","You think you're the only one doing time, Derek?"
1136,"01:17:03,920","01:17:06,131",You think you're here all alone?
1137,"01:17:06,172","01:17:08,008",You think I'm not in here with you?
1138,"01:17:20,645","01:17:22,105","Fuck, man."
1139,"01:17:24,983","01:17:27,277",Every day I watch you go through these sheets...
1140,"01:17:27,319","01:17:29,154",like you gonna get to the end of them.
1141,"01:17:30,488","01:17:32,616","Look, nigger, will you chill the fuck out?"
1142,"01:17:32,657","01:17:33,950",Goddamn!
1143,"01:17:33,992","01:17:36,161",No matter how fast you get through them...
1144,"01:17:36,202","01:17:38,747",they gonna keep bringing them in and bringing them in.
1145,"01:17:38,788","01:17:40,498",Throwing them around like that...
1146,"01:17:40,540","01:17:42,667",ain't gonna do a damn thing but give you a heart attack!
1147,"01:17:42,709","01:17:44,461",And you know what? That's cool with me!
1148,"01:17:44,502","01:17:46,921","But you gonna give me a goddamn heart attack, too!"
1149,"01:17:55,513","01:17:57,557","I know, I'm just a dumb, stupid nigger, right?"
1150,"01:17:57,599","01:17:59,309",What do I know?
1151,"01:18:01,353","01:18:04,898","I know I ain't the one getting mad at them sheets, though."
1152,"01:18:04,940","01:18:07,943","As a matter of fact, the only sheets I get mad at..."
1153,"01:18:07,984","01:18:09,945",I'll tell you.
1154,"01:18:11,446","01:18:14,032","All right, boy, this is what we gonna do."
1155,"01:18:14,074","01:18:15,909",We gonna hate some niggers. That's what we'll do today.
1156,"01:18:15,951","01:18:17,702",We gonna hate some goddamn niggers.
1157,"01:18:17,744","01:18:19,245",That's all we gonna do is hate some niggers all day.
1158,"01:18:19,287","01:18:22,457","Don't know what a nigger is, but we gonna hate them."
1159,"01:18:22,499","01:18:24,417",My cousin Derek is in the pen right now...
1160,"01:18:24,459","01:18:28,797","working next to a nigger, driving him nigger crazy."
1161,"01:18:46,982","01:18:49,317",See? That's the ticket.
1162,"01:18:50,318","01:18:51,611",Nice and easy.
1163,"01:18:53,154","01:18:54,906",Now we can ignore each other in peace.
1164,"01:18:58,743","01:19:01,454","""What are you doing?"" You know what he tells me?"
1165,"01:19:01,496","01:19:04,249","""It's better than the pig I just tried to fuck."""
1166,"01:19:07,168","01:19:09,546",He never lets me finish the joke.
1167,"01:19:09,587","01:19:11,047","You fuck him, too?"
1168,"01:19:13,091","01:19:16,052","Whatever. She's laying on her back, her legs are open..."
1169,"01:19:18,305","01:19:22,267",What's up? How you doing? There you go.
1170,"01:19:33,361","01:19:36,197",He was taking it from the Mexicans...
1171,"01:19:36,239","01:19:38,325",and dealing it out to his own people.
1172,"01:19:38,366","01:19:41,411",He didn't believe in shit. None of them did.
1173,"01:20:07,103","01:20:10,315","What? Come on, man."
1174,"01:20:10,357","01:20:14,569",Don't look at me like that. You know what that smells like.
1175,"01:20:14,611","01:20:16,988",Don't tell me this smell don't remind you of a woman.
1176,"01:20:19,366","01:20:20,742","God, I miss that smell, man."
1177,"01:20:21,868","01:20:25,288",The job I had on the outside wasn't much better than this...
1178,"01:20:25,372","01:20:27,499",but at least I got to go home every night...
1179,"01:20:27,540","01:20:30,001","and lie down next to that sweet smell, man."
1180,"01:20:32,045","01:20:35,507","God, I miss that. You got a woman?"
1181,"01:20:36,675","01:20:38,510","Yeah, you got a woman, man."
1182,"01:20:38,551","01:20:41,137","Let me give you some advice, all right?"
1183,"01:20:41,179","01:20:44,015",When she comes to visit you...
1184,"01:20:44,057","01:20:46,017","whatever you do, no matter what..."
1185,"01:20:46,059","01:20:48,019","don't let her leave here in a fight, man."
1186,"01:20:48,061","01:20:50,021",Don't let her walk out with a bad attitude...
1187,"01:20:50,063","01:20:52,691","'cause if you do, you spend the next week..."
1188,"01:20:52,732","01:20:55,527",wondering if she's getting her fuck on with somebody else...
1189,"01:20:55,568","01:20:57,028",you know what I'm saying?
1190,"01:20:57,070","01:20:59,531","So when she come to see you, it's nothing but sweet talk."
1191,"01:20:59,572","01:21:02,242","Send her away floating, all right?"
1192,"01:21:02,284","01:21:05,537",'Cause it's not like the real world where you can fight...
1193,"01:21:05,578","01:21:08,707",'cause you can make up and have that make-up sex.
1194,"01:21:08,748","01:21:10,625",Know what I'm saying? That angry sex.
1195,"01:21:10,667","01:21:12,377",That sex with an attitude.
1196,"01:21:12,419","01:21:15,755",You lay on your back and let her take out that aggression on you.
1197,"01:21:15,797","01:21:17,424","All guys know that, man. That's that good sex."
1198,"01:21:17,465","01:21:20,302","That's that pow, pow, pow."
1199,"01:21:20,343","01:21:23,305","Let her get on top, and she'll punish you first."
1200,"01:21:23,346","01:21:24,973","""You been a bad boy, huh?"
1201,"01:21:25,015","01:21:27,851","""You been a bad boy, and I'm gonna punish you."
1202,"01:21:27,892","01:21:29,477","""I'm gonna put it on you."
1203,"01:21:29,519","01:21:32,981","""Don't you ever... let... me... catch... you..."
1204,"01:21:33,023","01:21:36,318","""looking at... another... woman. Yeah, yeah."
1205,"01:21:36,359","01:21:37,986","""I may forgive you if you bring it."
1206,"01:21:38,028","01:21:40,488","""I think I can. I-I forgive."
1207,"01:21:40,530","01:21:43,617","""I forgive. Right there. You're hitting it."
1208,"01:21:43,658","01:21:45,584","""My spot. That's it. Right."
1209,"01:21:45,619","01:21:49,456","""Yes. I for-I forgive you. I forgive you."
1210,"01:21:49,497","01:21:52,125","""I for-I for- I for-I forgive you!"
1211,"01:21:52,167","01:21:54,336","""I love you!"""
1212,"01:22:11,853","01:22:13,939",How do you figure the Lakers to ever be a bigger dynasty...
1213,"01:22:13,980","01:22:15,774",than the Celtics?
1214,"01:22:15,815","01:22:18,318","The Lakers are a flare-up, a fluke."
1215,"01:22:18,353","01:22:19,527",Are you crazy?
1216,"01:22:19,569","01:22:21,613",One good coach for four years. The Celtics are a dynasty!
1217,"01:22:21,655","01:22:24,282","Come on, man. The Celtics, right?"
1218,"01:22:24,324","01:22:26,534",The ugliest team in the history of sports.
1219,"01:22:26,576","01:22:28,703","A dynasty of ugly motherfuckers, man."
1220,"01:22:28,745","01:22:30,956",Look at Kevin McHale.
1221,"01:22:30,997","01:22:33,750",James Worthy. That guy has a head like a melon.
1222,"01:22:33,792","01:22:35,126",He had ladies.
1223,"01:22:35,168","01:22:37,837",I can't even talk to you. I don't know what you're saying.
1224,"01:22:37,879","01:22:40,799",You are tweaking. Boston Celtics.
1225,"01:22:40,840","01:22:42,968",- How many is that? - That's enough.
1226,"01:22:43,009","01:22:44,177",Enough? All right.
1227,"01:22:48,014","01:22:49,349",You got that?
1228,"01:22:54,020","01:22:57,023","- I lost count, man. - Doesn't matter, man."
1229,"01:22:57,058","01:22:59,526",Who's counting anyway?
1230,"01:23:06,825","01:23:08,994","All right, so I wanna know something."
1231,"01:23:09,995","01:23:11,997",What the fuck landed you in here?
1232,"01:23:12,038","01:23:14,249","You didn't kill anybody, too skinny for a gangbanger."
1233,"01:23:14,291","01:23:16,960",Ain't that a bitch? Don't judge a book by its cover.
1234,"01:23:17,002","01:23:18,420",I can throw these things.
1235,"01:23:18,461","01:23:21,339",Whatever. Come on. What did you do?
1236,"01:23:21,381","01:23:23,967",None of your business. It's embarrassing.
1237,"01:23:24,009","01:23:25,844",It's none of your goddamn business.
1238,"01:23:27,012","01:23:29,973",Come on. Everybody in here is embarrassed.
1239,"01:23:30,015","01:23:32,475",Nobody in here got away with anything.
1240,"01:23:33,518","01:23:34,978",What'd you do?
1241,"01:23:36,855","01:23:39,482","Look, man, I stole a TV, all right?"
1242,"01:23:39,524","01:23:42,193",So you stole a TV. What's embarrassing about that?
1243,"01:23:42,235","01:23:45,989",I stole a TV from a store next to a doughnut shop.
1244,"01:23:46,031","01:23:48,992","I ran out, the owner's right behind me yelling."
1245,"01:23:49,034","01:23:50,910",Bam! I run into three cops.
1246,"01:23:50,952","01:23:54,414",I told you it was embarrassing. You're laughing.
1247,"01:23:54,456","01:23:57,000","Wait a sec, wait a sec."
1248,"01:23:57,042","01:23:58,877",That don't make sense.
1249,"01:24:00,128","01:24:03,965","Nah, you didn't get six years for stealing a TV. Come on."
1250,"01:24:04,007","01:24:07,427","I come out, the police officer grabs my arm..."
1251,"01:24:07,469","01:24:09,394",the TV falls on his foot and breaks it.
1252,"01:24:09,429","01:24:14,225",They said I threw the TV at him. Assault. Six years.
1253,"01:24:14,267","01:24:18,396",Come on. Tell the truth. You chucked it at him.
1254,"01:24:18,438","01:24:21,399","Like I said, I came out of the store..."
1255,"01:24:21,441","01:24:25,070","he grabbed my arm, it fell on his foot."
1256,"01:24:29,866","01:24:31,117",Come on now.
1257,"01:24:31,159","01:24:33,912","What you got for me, huh?"
1258,"01:24:34,955","01:24:36,289","There you go, baby!"
1259,"01:24:36,331","01:24:38,708",Yeah! That's what I'm talking about.
1260,"01:25:17,247","01:25:18,498",Fuck you!
1261,"01:25:18,540","01:25:20,417",Give me a towel. Hold him.
1262,"01:25:27,674","01:25:29,509","You wanna be a nigger, sweet boy?"
1263,"01:25:29,551","01:25:32,137",- Fuck you! - We gonna treat you like one.
1264,"01:25:32,178","01:25:35,307",- No. - Come on.
1265,"01:25:37,309","01:25:38,977","Come on, give it to him!"
1266,"01:25:50,196","01:25:51,740",Fuck you!
1267,"01:25:55,702","01:25:58,163",That was real sweet.
1268,"01:25:58,204","01:25:59,372",Fuck you!
1269,"01:26:31,947","01:26:32,989",How is he?
1270,"01:26:34,157","01:26:36,493","Well, he took six stitches."
1271,"01:27:17,951","01:27:20,919","Man, what the hell are you doing here, anyway?"
1272,"01:27:20,954","01:27:24,082","I came to talk about Danny, but we don't have to do that now."
1273,"01:27:24,124","01:27:26,126",I brought you some books.
1274,"01:27:28,461","01:27:31,756","What about him, you know? Don't keep me in suspense."
1275,"01:27:31,798","01:27:33,800",He's headed right where you are.
1276,"01:27:34,801","01:27:38,430",You know what? My mother already laid this trip on me.
1277,"01:27:38,471","01:27:41,182",Danny's not my responsibility.
1278,"01:27:41,224","01:27:42,934",What do you expect me to do with that?
1279,"01:27:42,976","01:27:45,770",It doesn't help me. Am I supposed to feel guilty?
1280,"01:27:45,812","01:27:47,230",I don't want you to do anything.
1281,"01:27:47,814","01:27:49,941",I need to know the truth about how you feel.
1282,"01:27:49,983","01:27:51,985",You think I want him in here?
1283,"01:27:52,020","01:27:54,446",I mean... I don't know.
1284,"01:27:54,487","01:27:55,947",I don't know what I feel. I'm all...
1285,"01:27:58,199","01:28:00,285",I feel a little inside out.
1286,"01:28:00,327","01:28:02,294","I'm, you know-I don't know."
1287,"01:28:02,329","01:28:06,249",There's some things that... that don't fit.
1288,"01:28:06,291","01:28:08,501","Well, that happens."
1289,"01:28:09,502","01:28:12,172",You are too damn smart to be floating around here...
1290,"01:28:12,213","01:28:14,633",pretending you don't see all the holes in this bullshit.
1291,"01:28:14,674","01:28:16,593","Hey, listen. I said I was confused."
1292,"01:28:16,635","01:28:18,803",I didn't say I didn't believe in it.
1293,"01:28:18,845","01:28:20,931",All right. That's why you have to stay open.
1294,"01:28:20,972","01:28:23,433","Right now, your anger is consuming you here."
1295,"01:28:23,475","01:28:26,645",Your anger is shutting down the brain God gave you.
1296,"01:28:26,686","01:28:28,688","God. You know, man? You've been talking about..."
1297,"01:28:28,730","01:28:30,565",what's going on with me since I was in high school.
1298,"01:28:30,607","01:28:33,443",How the fuck do you know what's going on inside me?
1299,"01:28:33,485","01:28:37,447","No, I know about me. I know about this place."
1300,"01:28:37,489","01:28:39,449",I know about the place you are in.
1301,"01:28:39,491","01:28:42,243",What do you know about the place I'm in?
1302,"01:28:42,285","01:28:44,454",There was a moment...
1303,"01:28:44,496","01:28:47,457",when I used to blame everything and everyone...
1304,"01:28:47,499","01:28:49,960",for all the pain and suffering...
1305,"01:28:50,001","01:28:52,128",and vile things that happened to me...
1306,"01:28:52,170","01:28:54,714",that I saw happen to my people.
1307,"01:28:54,756","01:28:56,549",Used to blame everybody.
1308,"01:28:56,591","01:29:00,136","Blamed white people, blamed society, blamed God."
1309,"01:29:00,178","01:29:03,348",I didn't get no answers 'cause I asked the wrong questions.
1310,"01:29:03,390","01:29:05,892",You have to ask the right question.
1311,"01:29:05,934","01:29:07,185",Like what?
1312,"01:29:09,604","01:29:12,524",Has anything you've done made your life better?
1313,"01:29:32,961","01:29:34,462","You gotta help me, man."
1314,"01:29:37,257","01:29:38,967",Just help me.
1315,"01:29:40,802","01:29:42,846","Get me out of here, you know?"
1316,"01:29:45,640","01:29:48,310",I'm up in four months for review.
1317,"01:29:49,978","01:29:51,980",Put in a word for me.
1318,"01:29:52,022","01:29:54,566","I already have. So you're out there, and then what?"
1319,"01:29:54,608","01:29:57,444",I don't want to fuck up my family anymore.
1320,"01:29:57,485","01:29:59,738",I'll go as far away as I can get.
1321,"01:29:59,779","01:30:01,573",That's not good enough.
1322,"01:30:01,615","01:30:05,035","You want my help, you gotta do better than that."
1323,"01:30:05,076","01:30:07,537",My help is not unconditional.
1324,"01:30:07,621","01:30:10,832",Running just ain't good enough.
1325,"01:30:43,531","01:30:46,826",Fuck him. Fuck him.
1326,"01:30:46,868","01:30:48,578",Fuck him. Let the niggers have him.
1327,"01:30:50,038","01:30:51,373","What's up, D?"
1328,"01:30:51,414","01:30:54,626",What's all that bullshit you pulled in the mess hall?
1329,"01:30:55,835","01:30:58,713",You out of your fucking mind? Are you fucking crazy?
1330,"01:30:58,755","01:31:01,049","D, look at me, man!"
1331,"01:31:01,091","01:31:03,677",You can't make it in here on your own.
1332,"01:31:03,718","01:31:05,804",I'm not afraid of those fucking pussies.
1333,"01:31:05,845","01:31:07,973","There was six of them, and they jumped me."
1334,"01:31:08,014","01:31:10,392",That won't happen again. I hope they fucking try.
1335,"01:31:10,433","01:31:12,936","Man, I'm not talking about your peckerwood friends!"
1336,"01:31:13,019","01:31:15,313",They're protecting your stupid ass!
1337,"01:31:15,355","01:31:19,150",You dissed them in public! Now you're on your fucking own!
1338,"01:31:19,192","01:31:21,987","Yo, man, I'm talking about the brothers, all right?"
1339,"01:31:22,028","01:31:25,156","They'll fuck you, then smoke your motherfucking ass!"
1340,"01:31:25,198","01:31:27,826",Why don't you tell me something I don't know?
1341,"01:31:27,867","01:31:29,995",You think I haven't thought about that?
1342,"01:31:30,036","01:31:33,498","If they come for me, they come. There ain't nothing I can do."
1343,"01:31:34,791","01:31:36,668","What can I do, man?"
1344,"01:31:41,548","01:31:44,009",So I was right back where I started.
1345,"01:31:44,050","01:31:46,094",Every day I was sure it was my day.
1346,"01:31:47,304","01:31:50,265",Every time I stepped out of my cell...
1347,"01:31:50,307","01:31:53,018",every time I got in that shower...
1348,"01:31:56,104","01:31:58,023",I figured it was only a matter of time...
1349,"01:31:58,064","01:32:00,025",before they made a move.
1350,"01:32:01,234","01:32:03,361",I just hoped it'd be quick.
1351,"01:32:35,018","01:32:37,354",But it never came.
1352,"01:32:39,064","01:32:40,315",I couldn't figure it out.
1353,"01:32:40,357","01:32:42,317",I knew some of them were itching for it.
1354,"01:32:42,359","01:32:44,361","After awhile, I just put my head down..."
1355,"01:32:44,444","01:32:46,237",and read the stuff that Sweeney sent me...
1356,"01:32:46,279","01:32:48,031",and I kept to myself.
1357,"01:32:50,116","01:32:53,745","Last six months in that place, I was like a ghost."
1358,"01:33:07,467","01:33:10,011","What's up, man? You getting out?"
1359,"01:33:12,138","01:33:13,932","Come on, man. What the fuck you waiting on?"
1360,"01:33:13,974","01:33:16,101","Get the fuck on outta here, man."
1361,"01:33:17,978","01:33:20,021","Yeah, you know, I got this funny feeling."
1362,"01:33:20,063","01:33:21,940","Oh, yeah? What's that?"
1363,"01:33:23,316","01:33:25,068",I'm thinking maybe the only reason...
1364,"01:33:25,110","01:33:26,945",I'm getting out of here in one piece is you.
1365,"01:33:28,488","01:33:29,948","Come on, man! Get the fuck outta here!"
1366,"01:33:29,990","01:33:31,992",You think I'm gonna put my neck on the line...
1367,"01:33:32,027","01:33:34,035",for some crazy ass peckerwood?
1368,"01:33:34,077","01:33:35,954",Yeah. Right.
1369,"01:33:35,996","01:33:38,164",Stupid.
1370,"01:33:43,837","01:33:45,505",That's what I thought.
1371,"01:33:49,843","01:33:52,095","I owe you, man."
1372,"01:33:52,137","01:33:54,306","Man, you don't owe me shit, all right?"
1373,"01:33:57,309","01:33:58,268","Yes, I do."
1374,"01:34:08,486","01:34:10,447",You'll be outta here in no time.
1375,"01:34:10,488","01:34:12,866","Man, it's a piece of cake, all right?"
1376,"01:34:15,118","01:34:16,953","Just take it easy on the brothers, all right?"
1377,"01:34:16,995","01:34:18,079",The brothers!
1378,"01:34:28,506","01:34:29,966","God, man."
1379,"01:34:32,510","01:34:34,346","Sorry, Derek."
1380,"01:34:35,347","01:34:37,515",Sorry that happened to you.
1381,"01:34:38,683","01:34:41,811","Well, I'm not. I'm lucky."
1382,"01:34:41,853","01:34:44,814","I feel lucky, 'cause it's wrong, Dan."
1383,"01:34:47,192","01:34:48,985","It's wrong, and it was eating me up."
1384,"01:34:49,027","01:34:50,987",It was gonna kill me.
1385,"01:34:51,029","01:34:53,031",And I kept asking myself all the time...
1386,"01:34:53,073","01:34:57,035","how did I buy into this shit, you know?"
1387,"01:34:58,703","01:35:00,538",It's just 'cause I was pissed off.
1388,"01:35:01,748","01:35:04,960",Nothing I ever did ever took that feeling away.
1389,"01:35:06,503","01:35:09,422","I killed two guys, Danny. I killed them."
1390,"01:35:11,299","01:35:13,468",And it didn't make me feel any different.
1391,"01:35:14,678","01:35:16,012",Just got me more lost...
1392,"01:35:16,054","01:35:18,515","and I'm tired of feeling pissed-off, Danny."
1393,"01:35:18,598","01:35:21,518",I'm just tired of it.
1394,"01:35:21,559","01:35:23,979",And I'm not telling you what to do.
1395,"01:35:25,313","01:35:26,648",I'm really not.
1396,"01:35:27,649","01:35:29,818",But I need you to understand...
1397,"01:35:31,653","01:35:34,990","'cause I love you, and you're my best friend."
1398,"01:35:37,117","01:35:38,994",Do you understand?
1399,"01:35:39,035","01:35:40,996","Yeah, I understand."
1400,"01:35:44,499","01:35:45,834",All right.
1401,"01:35:49,838","01:35:51,339",Jesus.
1402,"01:36:08,064","01:36:09,941",Hi. Everything OK?
1403,"01:36:09,983","01:36:11,359","Ah, everything's great."
1404,"01:36:11,401","01:36:14,154",Great. Yeah. You wanna sleep in our room?
1405,"01:36:14,195","01:36:16,156",- No. Thank you. - You sure?
1406,"01:36:16,197","01:36:19,451",Yeah. This is good. Thank you.
1407,"01:36:19,492","01:36:21,953","All right. Come on, let's go."
1408,"01:36:43,183","01:36:44,184",Good night.
1409,"01:37:51,167","01:37:53,003","I'm gonna take a shower, all right?"
1410,"01:38:27,203","01:38:28,455",It's hard to look back...
1411,"01:38:28,496","01:38:31,416",and see the truth about people you love.
1412,"01:38:31,458","01:38:34,419",I think if you asked Derek why it all went the way it did...
1413,"01:38:34,461","01:38:36,087",and where it all started...
1414,"01:38:36,129","01:38:38,965",he'd still say it started when our father was murdered.
1415,"01:38:40,133","01:38:42,427","The truth is, it started earlier."
1416,"01:38:42,469","01:38:45,680",Are we all meeting for the game tonight?
1417,"01:38:45,722","01:38:46,932",Definitely.
1418,"01:38:46,973","01:38:48,600","All right, Ben's Burger at 7:00..."
1419,"01:38:48,642","01:38:49,976",then we go watch the big guy play.
1420,"01:38:52,479","01:38:54,439",Psyching up for the game?
1421,"01:38:54,481","01:38:57,567",I'm always ready for that. I got an English exam.
1422,"01:38:57,651","01:38:59,945",I'm having a heart attack. I'm not ready.
1423,"01:38:59,986","01:39:01,988","What's the matter? Afraid you'll get a ""B""?"
1424,"01:39:02,030","01:39:04,950",Might do you good. B-minus.
1425,"01:39:04,991","01:39:07,911","Hey, don't laugh. This guy is different."
1426,"01:39:07,953","01:39:10,413",Dr. Sweeney. This guy's unbelievable.
1427,"01:39:10,455","01:39:12,457",Unbelievable. I've never had a teacher like this.
1428,"01:39:12,499","01:39:13,708",He's got two Ph. D.s.
1429,"01:39:13,750","01:39:17,379",I don't know what he's doing teaching at our school.
1430,"01:39:17,420","01:39:18,630",What's he got you reading?
1431,"01:39:18,672","01:39:22,300","We got this essay exam on ""Native Son."""
1432,"01:39:22,342","01:39:24,803","""Native Son""? I don't know that."
1433,"01:39:24,844","01:39:26,388",That's a big surprise.
1434,"01:39:27,514","01:39:28,890",What? I read.
1435,"01:39:30,141","01:39:33,478","Honey, they don't teach Tom Clancy in school."
1436,"01:39:35,146","01:39:36,940","Well, they don't."
1437,"01:39:36,982","01:39:38,441","So what is this ""Native Son""?"
1438,"01:39:39,609","01:39:41,987",It's this book about this black guy.
