number_of_dialog,start_time,end_time,dialog
722,"00:46:41,014","00:46:42,182",Stop!
723,"00:46:43,350","00:46:44,601",She can't breathe!
724,"00:46:46,519","00:46:47,646",Let her go!
725,"00:46:47,687","00:46:49,731",You going to apologize?
726,"00:46:51,691","00:46:54,903",You're a fucking asshole. I hate you!
727,"00:47:04,788","00:47:06,998",What are you doing? This is your family.
728,"00:47:07,040","00:47:09,000","Right. My family, so you know what?"
729,"00:47:09,042","00:47:12,379",I don't give two shits about you or what you think.
730,"00:47:12,420","00:47:14,214",You're not a part of it.
731,"00:47:14,255","00:47:16,675",- That has nothing to do with it. - It doesn't?
732,"00:47:16,716","00:47:18,510",You don't think I see what you're doing?
733,"00:47:18,551","00:47:20,136",You think I'll sit here and smile...
734,"00:47:20,178","00:47:22,681",while some fucking kike tries to fuck my mother?
735,"00:47:22,722","00:47:25,642",It's never going to happen. Fucking forget it.
736,"00:47:25,684","00:47:27,519",Not while I'm in this family.
737,"00:47:27,560","00:47:29,604",I will fucking cut your Shylock nose off...
738,"00:47:29,646","00:47:32,357",and stick it up your ass before I let that happen.
739,"00:47:32,399","00:47:34,901",Coming in here and poisoning my family's dinner...
740,"00:47:34,943","00:47:38,196","with your Jewish, nigger-loving, hippie bullshit."
741,"00:47:41,741","00:47:44,703",Fuck you. Fuck you.
742,"00:47:44,744","00:47:46,538","Yeah, walk out."
743,"00:47:46,579","00:47:49,082",Asshole. Fucking cabala-reading motherfucker.
744,"00:47:49,124","00:47:50,667",Get out of my house.
745,"00:47:55,672","00:47:57,882",You see this? That means not welcome.
746,"00:48:10,520","00:48:11,646",What did I do?
747,"00:48:11,688","00:48:13,690",You disgust me.
748,"00:48:13,732","00:48:16,401","Bring him to our table, primping your hair and your dress."
749,"00:48:16,443","00:48:18,611",What did I do?
750,"00:48:18,653","00:48:20,614",You're all tarted up.
751,"00:48:20,655","00:48:22,365",How could you bring him to my father's table?
752,"00:48:22,407","00:48:25,577",How could you go from Dad to that? Aren't you ashamed?
753,"00:48:25,619","00:48:29,039",I'm ashamed that you came out of my body!
754,"00:48:32,459","00:48:35,378",Go run to your fucking kike! Run to him!
755,"00:48:41,468","00:48:44,429","It's OK. I'm proud of you, baby."
756,"00:48:51,144","00:48:54,731","I'm so sorry, Doris. I really am."
757,"00:49:02,989","00:49:04,115",He's gone.
758,"00:49:04,157","00:49:08,954",He's just a boy without a father.
759,"00:49:08,995","00:49:12,707","Doris, you don't know the world your children are living in."
760,"00:49:22,592","00:49:24,219",Good-bye.
761,"00:50:09,681","00:50:11,266","Hey, you all right?"
762,"00:50:13,935","00:50:16,896","- Take this, you fucking dick! - No. Come here."
763,"00:50:16,938","00:50:18,523",- Fuck you! - Calm down.
764,"00:50:18,565","00:50:19,899",- Let go of me! - Calm down.
765,"00:50:19,941","00:50:21,192","Let me go, God damn it!"
766,"00:50:21,234","00:50:23,445",- Fuck you! - I'm sorry.
767,"00:50:25,030","00:50:27,372",I would never hurt you. You know that.
768,"00:50:27,407","00:50:31,036",I screwed up. I lost control. It's not you.
769,"00:50:31,077","00:50:34,247",I'm sorry. I'd never hurt you guys.
770,"00:50:34,289","00:50:36,958",You know that. I'd do anything for you.
771,"00:50:37,000","00:50:38,335",I don't believe you.
772,"00:50:38,376","00:50:40,712","I trust you, Derek."
773,"00:50:51,931","00:50:55,143",What are you doing out of bed? Want a plane ride?
774,"00:50:55,185","00:50:58,104",- Yeah. - Going for takeoff.
775,"00:51:04,277","00:51:05,695","Oh, no, don't crash."
776,"00:51:07,030","00:51:10,742",Better go to Mom. She's a crazy flier.
777,"00:51:10,784","00:51:13,787","Kiss Mom. Oh, yeah."
778,"00:51:22,420","00:51:25,715",- You don't feel too hot. - No. It's my chest.
779,"00:51:25,757","00:51:28,259",- What are you up to? - I'm just thinking.
780,"00:51:28,301","00:51:30,991",Yeah? There's a lot of that going around.
781,"00:51:31,026","00:51:33,682",I don't even know how we got here sometimes.
782,"00:51:33,723","00:51:36,476","I feel like I let you down, only I didn't know when it happened."
783,"00:51:36,518","00:51:38,228","Mom, it's OK."
784,"00:51:42,190","00:51:44,150",It's cold in here. No wonder you're sick.
785,"00:51:44,192","00:51:46,861",You don't get sick from cold. You get sick from germs.
786,"00:51:46,903","00:51:49,656",No. You get sick from smoking.
787,"00:51:50,824","00:51:54,369",You ought to quit. It's not good for you.
788,"00:52:00,125","00:52:02,127",What are you looking at me like that for?
789,"00:52:02,168","00:52:04,879",When are you going to let that beautiful hair grow back?
790,"00:52:06,673","00:52:08,758",The day you quit smoking.
791,"00:52:11,803","00:52:13,346",Deal.
792,"00:52:13,388","00:52:18,143",I'd better get Ally to bed. You say good night to Mom?
793,"00:52:18,184","00:52:20,312",Then you have to go to bed. Come on.
794,"00:52:20,353","00:52:22,856","- Good night, Mama. - Good night, baby."
795,"00:52:57,223","00:53:00,769",I go back to that night again and again in my mind.
796,"00:53:00,810","00:53:03,104",I try to stop it from happening.
797,"00:53:03,146","00:53:05,023",I want you out of this house.
798,"00:53:05,065","00:53:07,025",That's fine. I'll be gone in the morning.
799,"00:53:08,401","00:53:09,694",He can move in with me.
800,"00:53:11,071","00:53:13,323","In my mind, I imagine what would've happened..."
801,"00:53:13,365","00:53:16,743",if I hadn't gone to that room and told him.
802,"00:53:18,078","00:53:19,287",Get down!
803,"00:53:20,622","00:53:21,998","No, Derek!"
804,"00:53:23,583","00:53:26,044","Help, Mommy!"
805,"00:53:40,016","00:53:43,311","Nigger, you just fucked with the wrong bull. Come here!"
806,"00:53:43,353","00:53:44,437",Damn!
807,"00:53:44,479","00:53:47,941",Should've learned your place on the fucking basketball court...
808,"00:53:47,976","00:53:49,693",but you fucking monkeys never get the message!
809,"00:53:51,319","00:53:53,697","My father gave me that truck, you motherfucker!"
810,"00:53:53,738","00:53:57,409",You ever shoot at firemen? You shoot at my family?
811,"00:53:57,450","00:53:59,828","I'm going to teach you a real lesson now, motherfucker."
812,"00:53:59,869","00:54:02,080",Put your fucking mouth on the curb.
813,"00:54:02,122","00:54:03,088","Hold on, man."
814,"00:54:03,123","00:54:06,084",Put it on the curb right now!
815,"00:54:09,504","00:54:10,463",That's it.
816,"00:54:10,505","00:54:12,257","Derek, no!"
817,"00:54:16,720","00:54:18,305",Now say good night.
818,"00:54:31,151","00:54:32,110",Fucker.
819,"00:54:38,283","00:54:41,745",Drop your weapon! Put your weapon on the ground!
820,"00:54:41,828","00:54:43,788",Put your hands up!
821,"00:54:43,830","00:54:47,292",I said get your hands up! Now turn around!
822,"00:54:56,426","00:54:58,970",Put your hands behind your head!
823,"00:55:02,682","00:55:04,684",Get down on your knees right now!
824,"00:56:02,409","00:56:06,246",It's all right.
825,"00:56:08,206","00:56:09,332",Let's go.
826,"00:56:11,293","00:56:14,129",- Come on. - No.
827,"00:56:21,594","00:56:23,179",She ain't gonna open the door?
828,"00:56:23,221","00:56:25,807",Someone right fucking there looking at us. Hello?
829,"00:56:25,849","00:56:27,475","Danny, it's for you."
830,"00:56:28,476","00:56:30,312",Be right there.
831,"00:56:43,491","00:56:46,494","Open the door, Danny. It's fucking freezing!"
832,"00:56:46,536","00:56:48,538","Danny, I'm gonna be sick!"
833,"00:56:48,580","00:56:51,583","Come on, Danny!"
834,"00:57:22,155","00:57:23,531",I'm gonna go get some beers.
835,"00:57:36,670","00:57:38,797","Hey, what a party, fatso?"
836,"00:57:38,838","00:57:42,634","I'm not fat, asshole! I'm husky!"
837,"00:57:42,676","00:57:44,678","What the fuck's up, Seth?"
838,"00:57:44,719","00:57:46,972","Drink up, Danny, before your brother sees you."
839,"00:57:47,013","00:57:48,223","Holy fuck, he's here!"
840,"00:57:48,264","00:57:51,518","Yeah, he's fucking here. Go pay your respects."
841,"00:57:51,559","00:57:52,560","Fuck you, Seth!"
842,"00:57:54,938","00:57:57,649","Let's go talk to Cameron, Danny."
843,"00:57:57,691","00:57:59,484",- Father Vinyard? - How's it going?
844,"00:57:59,526","00:58:02,320","I'm Jason, this is Chris. We're friends with your brother."
845,"00:58:02,362","00:58:05,073","You are a fucking god, man!"
846,"00:58:23,216","00:58:25,135",I thought you turned that paper in.
847,"00:58:25,176","00:58:27,971",I did. Now fucking Murray turned me in...
848,"00:58:28,013","00:58:31,224",so Sweeney's making me write another one.
849,"00:58:32,809","00:58:36,104",Good old Sweeney. He never stops trying.
850,"00:58:36,146","00:58:39,107","He's one of those ""proud to be nigger"" people."
851,"00:58:39,149","00:58:40,532",I hate those guys.
852,"00:58:40,567","00:58:43,778","Wait a minute, Danny. He's not proud."
853,"00:58:43,820","00:58:49,284","No. He's a manipulative, self-righteous Uncle Tom."
854,"00:58:49,326","00:58:52,537",He's making you feel guilty about writing on Adolf Hitler.
855,"00:58:52,579","00:58:57,709","Some nigger, some spic writes about Martin Luther King..."
856,"00:58:57,751","00:59:02,255",or fucking Cesar commie Chavez gets a pat on the head.
857,"00:59:02,297","00:59:04,382",Yeah.
858,"00:59:04,424","00:59:08,261","You can see the hypocrisy in that, can't you?"
859,"00:59:08,303","00:59:09,304",Definitely.
860,"00:59:13,767","00:59:15,310","Come on, let's go."
861,"00:59:15,352","00:59:18,188",No. Listen. Wait.
862,"00:59:18,229","00:59:20,190","I want to see you, OK?"
863,"00:59:20,231","00:59:23,234","I do, but I gotta take care of something tonight."
864,"00:59:25,153","00:59:27,781",- OK. - You understand?
865,"00:59:27,822","00:59:31,159","Yeah. I'm here. When you're ready, I'm here."
866,"00:59:34,955","00:59:37,540",- Would you do something with me? - Anything.
867,"00:59:37,582","00:59:39,542",Leave with me.
868,"00:59:39,626","00:59:42,128",Leave where?
869,"00:59:42,170","00:59:46,091",Leave here. Leave all this. Just come with me.
870,"00:59:46,132","00:59:48,093",Why would you want to leave?
871,"00:59:48,134","00:59:49,761",They worship you. You're like a god to them.
872,"00:59:49,803","00:59:53,264","If we had it good before, wait till you see what it's like now."
873,"00:59:53,306","00:59:56,935",I don't want all that. I don't want my family involved.
874,"00:59:56,977","00:59:59,521","Everything I've done here fucked it all up, understand?"
875,"00:59:59,562","01:00:01,606",You think what you did was wrong?
876,"01:00:01,648","01:00:04,484","Oh, baby. Oh, come on."
877,"01:00:04,526","01:00:07,070",Those niggers got exactly what they deserved...
878,"01:00:07,112","01:00:09,447",and we all know that.
879,"01:00:09,489","01:00:12,617","I understand you just got out, but no one's gonna hurt you."
880,"01:00:12,659","01:00:15,120",No one can touch you. There's a small army out there.
881,"01:00:15,161","01:00:17,747",We're not gonna let a bunch of spooks kick us out.
882,"01:00:17,789","01:00:20,083",You're not listening to me. I'm not scared.
883,"01:00:20,125","01:00:22,335",I don't want it anymore.
884,"01:00:22,377","01:00:26,006",I'm done with it. I'm through with this.
885,"01:00:26,047","01:00:30,927","It's bullshit, Stacey."
886,"01:00:30,969","01:00:34,055","You don't need this, Stacey. Come on, trust me."
887,"01:00:34,097","01:00:37,851","If you want to be with me, just trust me. Come with me."
888,"01:00:37,892","01:00:39,144",Come on.
889,"01:00:39,185","01:00:42,647",You're nuts. You are nuts. No way.
890,"01:00:42,689","01:00:45,734",I don't think you realize what's been going on here.
891,"01:00:45,775","01:00:49,571","We are 10 times what we were, and we are bloody organized."
892,"01:00:49,613","01:00:52,157",It is like nothing you have ever seen.
893,"01:00:52,198","01:00:54,034",This was a mistake. Forget it.
894,"01:00:54,075","01:00:56,494",Wait a second. What was a mistake?
895,"01:00:56,536","01:00:58,747","Stacey, just say good-bye."
896,"01:00:58,788","01:01:01,708",This isn't you. I know you.
897,"01:01:01,750","01:01:03,668","You don't know anything about me, Stacey."
898,"01:01:11,384","01:01:13,852",- Are you Danny's brother? - Yeah.
899,"01:01:13,887","01:01:16,931",Will you tell him Lizzy's looking for him?
900,"01:01:16,973","01:01:18,933",Thank you.
901,"01:01:20,685","01:01:24,522","We'll let the niggers, kikes, and spics grab for the pie."
902,"01:01:24,564","01:01:26,733",Can't blame 'em.
903,"01:01:26,775","01:01:29,277","Course, they're gonna have to fight to get it."
904,"01:01:31,071","01:01:33,865",And if we scare the fuck out of people...
905,"01:01:33,907","01:01:37,911","and a few people get killed in the process, so be it."
906,"01:01:37,953","01:01:40,622","Gonna put that in your paper, Danny?"
907,"01:01:40,664","01:01:43,375","Hey, man."
908,"01:01:43,416","01:01:47,754","Well, look who's here. The return of the soldier."
909,"01:01:47,796","01:01:49,798","What are you doing here, Danny?"
910,"01:01:49,839","01:01:52,926","Come on, man. I had to check it out."
911,"01:01:52,968","01:01:54,219",You knew I was gonna come.
912,"01:01:54,260","01:01:58,223","Let the kid alone, Derek. He knows when to go to bed."
913,"01:02:00,225","01:02:01,393",Go wait outside.
914,"01:02:01,434","01:02:03,728","Come on, Der. I'm not doing anything."
915,"01:02:03,770","01:02:07,190",This little blonde girl keeps asking for you.
916,"01:02:07,273","01:02:09,025",She's dying. Come on.
917,"01:02:09,067","01:02:11,486",- I gotta check out. - Go easy on her.
918,"01:02:11,528","01:02:13,530",All right.
919,"01:02:17,367","01:02:18,994",Wait for me right outside.
920,"01:02:23,832","01:02:26,001",Take it easy.
921,"01:02:26,042","01:02:28,461",Chill out.
922,"01:02:28,503","01:02:30,922",You're on safe ground.
923,"01:02:30,964","01:02:33,675",You don't have to watch your ass around here.
924,"01:02:35,135","01:02:37,095",Come on. Sit down. Relax.
925,"01:02:39,139","01:02:41,933",I'm sorry. The party was a little quick...
926,"01:02:41,975","01:02:45,228","but we're just so damn glad you're back, Derek."
927,"01:02:45,270","01:02:47,314",It's only natural you should feel a little funny.
928,"01:02:47,355","01:02:48,815","I don't feel funny, Cam."
929,"01:02:48,857","01:02:51,610",You made the fat kid a little nervous.
930,"01:02:51,651","01:02:53,653",He thinks the joint messed with your mind.
931,"01:02:53,688","01:02:55,155",It did.
932,"01:03:02,245","01:03:11,046","Glory, glory, hallelujah..."
933,"01:03:11,087","01:03:14,424",The white man marches on!
934,"01:03:14,466","01:03:17,636",Things have changed since you've been gone.
935,"01:03:17,677","01:03:19,846",You talk about organization?
936,"01:03:19,888","01:03:22,807",Wait'll you see what we've done with the internet.
937,"01:03:22,849","01:03:24,809",We've got every gang from Seattle to San Diego...
938,"01:03:24,851","01:03:26,436",working together now.
939,"01:03:26,478","01:03:28,938",Not competing anymore. They're consolidated.
940,"01:03:29,022","01:03:31,399",Only thing we lack is a little overall leadership.
941,"01:03:31,441","01:03:34,611",That's where you come in.
942,"01:03:34,653","01:03:37,697",Those people out there got a lot of respect for you.
943,"01:03:37,739","01:03:39,991","When you're ready, come talk to me about it."
944,"01:03:40,033","01:03:43,787","You can forget about that. I'm done with it, Cam."
945,"01:03:43,828","01:03:47,457","Yeah, well, I know you grew out of..."
946,"01:03:47,499","01:03:51,002","that shaved head bullshit a long time ago, thank God."
947,"01:03:51,044","01:03:52,796",I like your hair the way it is now.
948,"01:03:52,837","01:03:55,840","See, that's what I mean. We're thinking bigger now."
949,"01:03:55,882","01:03:57,634",No more of this fucking grocery store-
950,"01:03:57,676","01:03:59,552",You're not listening to me. I am done with it.
951,"01:03:59,594","01:04:01,846","All that bullshit out there and all your bullshit, too."
952,"01:04:01,888","01:04:03,556",I'm out.
953,"01:04:03,598","01:04:06,726",I understand how you feel. You've just done hard time.
954,"01:04:06,768","01:04:08,895",Don't you fucking talk to me about hard time.
955,"01:04:08,937","01:04:11,106",- You don't know anything. - I've done mine.
956,"01:04:11,147","01:04:13,531",You didn't do shit. I found out about you.
957,"01:04:13,566","01:04:15,568","You did two months, then rolled over on two kids..."
958,"01:04:15,603","01:04:17,529",and let them go down for you.
959,"01:04:17,570","01:04:19,531","So don't feed me your fucking lies, Cameron."
960,"01:04:21,324","01:04:24,744",All right. This is stupid. I'm done.
961,"01:04:24,786","01:04:27,455",You go cool off. Get laid. Do something.
962,"01:04:27,497","01:04:30,333","Get your head on straight, and then I'll talk to you."
963,"01:04:30,375","01:04:32,460","But it doesn't matter if I don't, does it?"
964,"01:04:32,502","01:04:34,462",'Cause you got the next crop...
965,"01:04:34,504","01:04:36,298","lined up and ready to go, you fucking chicken hawk."
966,"01:04:36,339","01:04:38,216",Excuse me?
967,"01:04:38,258","01:04:40,885","You prey on people, Cam! You use them!"
968,"01:04:40,927","01:04:44,014",I lost three years of my life for your fucking phony cause...
969,"01:04:44,055","01:04:45,807","but I am on to you now, you fucking snake."
970,"01:04:45,849","01:04:49,936","Derek, watch it. Be careful. Remember where you are."
971,"01:04:49,978","01:04:53,648",This isn't some fucking country club you can waltz in and out-
972,"01:04:53,690","01:04:55,483",Shut up! Shut the fuck up!
973,"01:04:55,525","01:04:58,445",I came here to tell you one thing. I am out.
974,"01:04:58,480","01:05:00,363","Out! And Danny is out, too!"
975,"01:05:00,405","01:05:02,657","If you come near my family, I'll fucking kill you."
976,"01:05:02,699","01:05:05,160","Excuse me, but fuck you, Derek."
977,"01:05:05,201","01:05:07,495",You can't come barking threats at me.
978,"01:05:07,537","01:05:10,415","You can do whatever you want, but Danny is a good kid."
979,"01:05:10,457","01:05:12,792",He's not some whiny pussy like you.
980,"01:05:12,834","01:05:14,794","He needs my help, and I'm gonna give it to him."
981,"01:05:14,829","01:05:17,262",If you come near Danny again...
982,"01:05:17,297","01:05:19,507","I will feed you your fucking heart, Cameron."
983,"01:05:19,549","01:05:25,388",I won't have to. He'll come to me.
984,"01:05:25,430","01:05:27,599",I'm more important to him now than you'll ever be.
985,"01:05:32,020","01:05:33,104",Shit.
986,"01:05:33,146","01:05:36,107","You're a fucking dead man, Vinyard."
987,"01:05:51,623","01:05:54,960","Hey, where's Cameron? Where the fuck is he?"
988,"01:05:57,629","01:05:59,798","Stay away from me, Stacey. Danny!"
989,"01:05:59,839","01:06:01,800",Why don't you share with the rest of us...
990,"01:06:01,841","01:06:05,387","what you just said to me, you piece of shit nigger!"
991,"01:06:05,428","01:06:07,639",You monkey-fucking traitor!
992,"01:06:07,681","01:06:09,432",You a fucking nigger-fucker?
993,"01:06:09,474","01:06:11,434","Hey, Danny! Come on!"
994,"01:06:11,476","01:06:13,937",He's a fucking nigger! Nigger! Nigger!
995,"01:06:14,020","01:06:16,940",Cam's out cold! Where the fuck are you going?
996,"01:06:16,982","01:06:18,942",Gun! He's got a gun!
997,"01:06:19,025","01:06:21,319",Shit! Back up!
998,"01:06:22,904","01:06:24,823",You make me fucking sick!
999,"01:06:24,864","01:06:27,701",Put down the fucking gun!
1000,"01:06:27,742","01:06:28,952",Shoot the nigger!
1001,"01:06:28,994","01:06:32,831","Shoot him! Do it, Seth! Shoot him!"
1002,"01:06:32,872","01:06:35,083",Traitor!
1003,"01:06:35,125","01:06:36,501","Do it, Seth! Do it!"
1004,"01:06:39,671","01:06:41,464",Back up! Move!
1005,"01:06:43,466","01:06:45,844",Back up! Back the fuck up!
1006,"01:06:45,885","01:06:48,305",Move! Move!
1007,"01:06:48,346","01:06:49,639","Easy, Derek! Hey!"
1008,"01:07:11,328","01:07:12,287","Easy, Danny!"
1009,"01:07:12,329","01:07:14,372",Who do you think you are?
1010,"01:07:14,414","01:07:17,417","- Danny, relax. - Who do you think you are?"
1011,"01:07:17,459","01:07:19,753","Take it easy, Dan."
1012,"01:07:19,794","01:07:21,880","I fucking hate you, Der!"
1013,"01:07:21,921","01:07:23,923",All right. I mean it.
1014,"01:07:23,965","01:07:25,425",Huh?
1015,"01:07:25,467","01:07:28,053",Come on. Shut up. Take it easy.
1016,"01:07:28,094","01:07:30,055","What's happened to you, Der?"
1017,"01:07:30,096","01:07:32,474",Take it easy.
1018,"01:07:32,515","01:07:34,851","What's happened to you, Der?"
1019,"01:07:42,943","01:07:45,612",Come on. Come on.
1020,"01:07:48,782","01:07:50,909",It's just so fucked.
1021,"01:07:50,951","01:07:53,954",I'm sorry. You weren't supposed to see that.
1022,"01:07:53,989","01:07:55,205",I told you not to come.
1023,"01:07:55,246","01:07:57,874","Fuck you, man."
1024,"01:07:57,916","01:07:59,459",That was so fucked up.
1025,"01:07:59,501","01:08:02,087","I know, I know."
1026,"01:08:02,128","01:08:04,756","God, it wasn't supposed to happen that way."
1027,"01:08:04,798","01:08:08,093",That was fucked up. That's all there is to it.
1028,"01:08:08,134","01:08:11,930",That's not what I planned. It just all went to shit.
1029,"01:08:11,972","01:08:15,600",Just shit. Got totally out of control.
1030,"01:08:17,143","01:08:19,938",What's fucking happening here?
1031,"01:08:24,526","01:08:25,902","Hey, look at me."
1032,"01:08:30,240","01:08:31,741","I can't go back to that, Dan."
1033,"01:08:31,783","01:08:34,077",Can't go back to what?
1034,"01:08:34,119","01:08:36,204",To any of it.
1035,"01:08:36,246","01:08:38,790","Those guys, the gang, that life. I'm done with it."
1036,"01:08:43,003","01:08:44,462",What happened to you up there?
1037,"01:08:52,345","01:08:54,431",Feed line. Back up for chow.
1038,"01:08:54,472","01:08:56,349","Don't be late, you piece of shit!"
1039,"01:08:56,391","01:09:00,395",Let's go if you want to eat! Get up! Five minutes!
1040,"01:09:00,437","01:09:02,731",This is my fucking house! Get up!
1041,"01:09:02,772","01:09:05,150","What the fuck's your problem, you assholes?"
1042,"01:09:05,191","01:09:08,361",Move! Let's go! Open the fucking gates!
1043,"01:09:08,403","01:09:10,780","All right, rack 'em!"
1044,"01:09:15,452","01:09:17,537",Five minutes! Step forward!
1045,"01:09:17,579","01:09:19,956",Those beds better be made.
1046,"01:09:22,500","01:09:25,462","After two days, I didn't think I'd make it a week."
1047,"01:09:25,545","01:09:27,631","Come on, you motherfuckers!"
1048,"01:09:27,672","01:09:30,008","You want to eat today, you fucking piece of shit?"
1049,"01:09:30,050","01:09:32,010","Hey, you white trash piece of shit!"
1050,"01:09:32,052","01:09:33,970","You think you're fucking special, whitefish?"
1051,"01:09:34,012","01:09:37,182",Button that top button! Let's go! Move!
1052,"01:09:37,223","01:09:40,435","Are you eyeballing me? Don't eyeball-fuck me, asshole!"
1053,"01:09:40,477","01:09:43,021",I'll fucking kill you!
1054,"01:09:43,063","01:09:46,066","I'm gonna keep my eye on you, you white piece of shit!"
1055,"01:09:47,859","01:09:50,820","Don't fucking eyeball me, boy! I'll fucking skull-fuck you!"
1056,"01:09:50,904","01:09:52,864",Step forward!
1057,"01:09:54,199","01:09:55,158",Turn to the left.
1058,"01:09:57,243","01:10:00,705",Step forward to chow! Let's go!
1059,"01:10:00,747","01:10:03,166","Come on! Hey, fish, straight ahead."
1060,"01:10:03,201","01:10:05,585","Straight ahead, fucker! Let's go!"
1061,"01:10:05,627","01:10:08,755",All the wrong people knew who I was anyway...
1062,"01:10:08,797","01:10:11,925",so I figured I'd put up a flag and hope a friend sees it.
1063,"01:11:14,404","01:11:17,324",That's the cat I'm talking about right there.
1064,"01:11:36,509","01:11:38,511",Boss.
1065,"01:11:38,553","01:11:40,138",Have a seat.
1066,"01:11:41,181","01:11:42,307",It's a pleasure.
1067,"01:11:52,317","01:11:54,778","Don't fuck with me, all right?"
1068,"01:11:54,819","01:11:57,155",'Cause I'm the most dangerous man in this prison.
1069,"01:11:57,197","01:12:01,117",You know why? 'Cause I control the underwear.
1070,"01:12:08,959","01:12:11,920","We pick 'em up over here, and we store 'em over there."
1071,"01:12:11,962","01:12:13,922","And I hope you work out, all right?"
1072,"01:12:13,964","01:12:16,967",'Cause the last guy they sent me didn't wear no drawers...
1073,"01:12:17,050","01:12:19,177",couldn't read the sizes in the drawers...
1074,"01:12:19,219","01:12:21,388","and used to sniff the drawers, all right?"
1075,"01:12:21,429","01:12:23,848","We got two sizes-medium and large, all right?"
1076,"01:12:23,890","01:12:26,351",All you gotta do is put the mediums with the mediums...
1077,"01:12:26,393","01:12:28,019","and the larges with the larges, all right?"
1078,"01:12:28,061","01:12:30,021",I know it's a boring job...
1079,"01:12:30,063","01:12:32,232",but it's better than that last shit they had me doing.
1080,"01:12:32,274","01:12:36,194",I spent two years in the kitchen scrubbing hot-ass pots and pans.
1081,"01:12:36,236","01:12:39,114","That you don't wanna do, all right?"
1082,"01:12:39,155","01:12:41,157",You should be happy as shit you landed this job.
1083,"01:12:41,199","01:12:44,035",There's no telling what they'd have you do up in the joint.
1084,"01:12:45,578","01:12:49,082",By the way...
1085,"01:12:49,124","01:12:50,750",what you in for?
