number_of_dialog,start_time,end_time,dialog
374,"00:27:52,879","00:27:55,639",They're all a bunch of fucking freeloaders.
375,"00:27:55,680","00:27:58,058",We don't know 'em. We don't want to know 'em.
376,"00:27:58,093","00:27:59,309",They're the fucking enemy.
377,"00:28:01,770","00:28:03,521",What don't you like about them...
378,"00:28:03,563","00:28:05,482",and say it with some fucking conviction.
379,"00:28:05,523","00:28:08,735",I hate the fact it's cool to be black these days.
380,"00:28:08,777","00:28:09,903",Good.
381,"00:28:09,944","00:28:14,032",I hate this hip-hop influence on white fucking suburbia.
382,"00:28:14,074","00:28:15,617",Good.
383,"00:28:15,659","00:28:19,788",I hate Tabitha Soren and her Zionist MTV fucking pigs...
384,"00:28:19,829","00:28:21,414",telling us we should get along.
385,"00:28:21,456","00:28:24,584","Save the rhetorical bullshit, Hillary Rodham Clinton..."
386,"00:28:24,626","00:28:26,378",'cause it ain't gonna fucking happen.
387,"00:28:26,419","00:28:28,546",That's some of the best shit I've ever heard.
388,"00:28:28,588","00:28:32,217","I feel sorry for you, Danny."
389,"00:28:32,258","00:28:34,386","You don't believe any of that shit, right?"
390,"00:28:34,427","00:28:35,553",Shut up.
391,"00:28:35,595","00:28:39,182","No. Get out of the house now, you piece of shit."
392,"00:28:39,224","00:28:41,935","Is that any way to talk to a guest, a friend?"
393,"00:28:41,977","00:28:44,145","Derek hates you, and you don't realize it."
394,"00:28:44,187","00:28:46,731",How do you know who I hate?
395,"00:28:46,773","00:28:50,110",Back from the dead. God bless Jesus Christ.
396,"00:28:50,151","00:28:52,570","God, I think you lost weight."
397,"00:28:52,612","00:28:54,781",I can get my arms almost all the way around you.
398,"00:28:54,823","00:28:58,910","Fifty fucking pounds, man. Look at this hair. Holy shit."
399,"00:28:58,952","00:29:02,080",I told him it's gotta go.
400,"00:29:02,122","00:29:04,249",Grab your jacket. Let's get the fuck out of here.
401,"00:29:04,291","00:29:08,420",I want to talk to him. One second.
402,"00:29:08,461","00:29:13,383","Hey, listen. Did you pull some shit in school today?"
403,"00:29:13,425","00:29:16,594",- Just the usual. - This kid is awesome as hell.
404,"00:29:16,636","00:29:19,556","Did you turn in a paper on ""Mein Kampf""?"
405,"00:29:20,849","00:29:24,102","- Sweeney shit his pants. - He did, man."
406,"00:29:24,144","00:29:27,188",Was that your idea or did Cameron put you up to that?
407,"00:29:27,230","00:29:30,066",No. I thought it would be cool. How'd you know?
408,"00:29:30,108","00:29:32,277",It doesn't matter how I knew.
409,"00:29:32,319","00:29:34,612",This kid is smart as hell.
410,"00:29:34,654","00:29:36,656",Was that Sweeney on the phone?
411,"00:29:36,698","00:29:38,575",Sweeney called and told me.
412,"00:29:38,616","00:29:41,619","God, I hate that fucking nigger, man."
413,"00:29:41,661","00:29:43,121",He's gotta get a fucking life.
414,"00:29:44,372","00:29:46,082",Sweeney's a good teacher.
415,"00:29:46,124","00:29:48,293",Sweeney is a nigger on a power trip.
416,"00:29:48,335","00:29:50,378",That's what he was like when we were there...
417,"00:29:50,420","00:29:52,922",and that's how he is now. It'll never change.
418,"00:29:52,964","00:29:54,132",Fuck that nigger!
419,"00:29:54,174","00:29:56,259","- Seth, go away. - Are you kidding?"
420,"00:29:56,301","00:29:59,638",Nope. Wait in Danny's room. I want to talk to my brother.
421,"00:29:59,679","00:30:02,515",I've been here 15 minutes. I'm starving.
422,"00:30:06,728","00:30:10,607","Come here. Seriously, look. Forget this yahoo."
423,"00:30:10,649","00:30:13,568",He kills bugs for a living. You don't want to be like that.
424,"00:30:13,610","00:30:15,153",I'm serious. It's not funny.
425,"00:30:15,195","00:30:17,530",Sweeney is a good teacher. You can learn a lot from him.
426,"00:30:17,572","00:30:20,784",Don't go fuck it up with small fry shit like that.
427,"00:30:20,825","00:30:22,167",You don't understand.
428,"00:30:22,202","00:30:24,329",You got to see the bullshit paper he's making me write.
429,"00:30:24,371","00:30:26,915",He told me all about it. I don't care.
430,"00:30:26,957","00:30:29,668",You do anything he tells you to do. I mean it.
431,"00:30:29,709","00:30:31,795",I don't want you getting in trouble in school...
432,"00:30:31,836","00:30:35,215","trying to impress me, taking this shit in there."
433,"00:30:35,250","00:30:37,008",Do you understand what I'm saying?
434,"00:30:37,050","00:30:40,762","Yeah, I guess, but, I mean, I thought you'd be happy."
435,"00:30:40,804","00:30:42,222","Well, I'm not."
436,"00:30:44,724","00:30:46,059",Listen to that.
437,"00:30:46,935","00:30:50,021","Yeah, I know. It's been getting worse."
438,"00:30:50,063","00:30:51,439",Don't worry about it.
439,"00:30:51,481","00:30:53,400",I'll talk to you about this later.
440,"00:30:56,403","00:30:58,279",She's coughing her lungs out...
441,"00:30:58,321","00:31:00,949",and you're blowing this in her face all day.
442,"00:31:00,991","00:31:02,200",I'm putting it out.
443,"00:31:02,242","00:31:05,704","Hey, come on. I want to talk to you."
444,"00:31:10,083","00:31:13,086","Mommy, are you OK?"
445,"00:31:18,925","00:31:20,635",Put that out.
446,"00:31:20,677","00:31:23,888",I was just yelling at him for blowing smoke in your face.
447,"00:31:23,930","00:31:26,141","Nice thing to come home to, huh?"
448,"00:31:28,685","00:31:29,978",You all right?
449,"00:31:30,979","00:31:32,188",You all right?
450,"00:31:38,320","00:31:40,822","Look, you got to take it easy."
451,"00:31:40,864","00:31:42,747",You got to get some rest.
452,"00:31:42,782","00:31:44,909","Take Danny's and my room, and we'll hit the couch."
453,"00:31:44,951","00:31:47,871",I've been on the couch for ages. The couch is fine.
454,"00:31:47,912","00:31:49,754","No, it's not fine. This is terrible."
455,"00:31:49,789","00:31:53,585",We can't live like this. We gotta get out of here.
456,"00:31:55,712","00:31:57,881",Can I go with you?
457,"00:31:57,922","00:32:01,217",Yeah. We all gotta get out of here.
458,"00:32:01,259","00:32:04,763",- I could drop out and get a job. - Absolutely not.
459,"00:32:04,804","00:32:06,806",You got to finish. I'll work something out.
460,"00:32:10,393","00:32:15,231","Derek, can we please go eat? I'm fucking starving here."
461,"00:32:15,273","00:32:17,067",Go wait in the living room.
462,"00:32:18,234","00:32:20,403",I want him out of my house.
463,"00:32:20,445","00:32:21,946",I know. Look.
464,"00:32:37,170","00:32:40,027",He's an idiot. He's always been an idiot.
465,"00:32:40,062","00:32:42,884",He can't help it. I got to do that paper.
466,"00:32:42,926","00:32:45,261",I'll catch up with you later tonight.
467,"00:32:45,303","00:32:48,431",Not at Cameron's. I need you to stay away from there.
468,"00:32:48,473","00:32:51,935",- We were going to hang. - I'll explain it later.
469,"00:32:51,977","00:32:54,437","I just need you to stay away from the party, all right?"
470,"00:32:54,479","00:32:55,605",Whatever.
471,"00:32:55,647","00:32:59,234",Promise me you'll stay away from that party tonight.
472,"00:32:59,275","00:33:01,528","I'm not fucking 14 anymore, all right?"
473,"00:33:02,737","00:33:04,030",Whatever.
474,"00:33:06,032","00:33:06,992",God!
475,"00:33:13,123","00:33:14,833","Come on, let's go."
476,"00:33:16,459","00:33:17,752",Where are you parked?
477,"00:33:17,794","00:33:19,045",Out back.
478,"00:34:28,073","00:34:29,783","Yeah, that's the whole bunch."
479,"00:34:31,201","00:34:34,120",It didn't take long for Derek to make a name for himself...
480,"00:34:34,155","00:34:36,247",and Cameron knew just how to use it.
481,"00:34:36,289","00:34:37,624",You don't want to stick around?
482,"00:34:37,666","00:34:41,753","You know I'd love to, but I got to be careful."
483,"00:34:41,795","00:34:43,797","Yeah, I know."
484,"00:34:44,464","00:34:46,341",I'll see you back at the house.
485,"00:34:47,759","00:34:49,100",Good luck.
486,"00:34:49,135","00:34:53,098","He sent Derek to the kids, to the frustrated ones..."
487,"00:34:53,139","00:34:54,975",the ones who were sick of getting their asses kicked...
488,"00:34:55,016","00:34:57,435",by black and Mexican gangs.
489,"00:34:57,477","00:35:00,313","""Don't just be some punk. Be part of something."""
490,"00:35:00,355","00:35:03,233","All right, let's go. Pull it together."
491,"00:35:03,274","00:35:04,943",And everybody ate it up.
492,"00:35:04,985","00:35:07,404",They did whatever Derek told them to.
493,"00:35:08,405","00:35:10,699",Let's go. We're not here to fucking socialize.
494,"00:35:12,492","00:35:13,743",Shut the fuck up.
495,"00:35:13,785","00:35:14,995","Yeah, man."
496,"00:35:15,036","00:35:16,371",You want a little toke?
497,"00:35:17,831","00:35:19,249",Go ahead.
498,"00:35:19,291","00:35:21,876","- Curtis, what is that? - Come on, Derek."
499,"00:35:21,918","00:35:24,671",Weed is for niggers. Put that away right now.
500,"00:35:24,713","00:35:25,964",Jesus fucking Christ.
501,"00:35:26,006","00:35:27,424",Have a little self-respect.
502,"00:35:28,883","00:35:32,846","All right, listen up. We need to open our eyes."
503,"00:35:34,180","00:35:36,766",There's over two million illegal immigrants...
504,"00:35:36,808","00:35:39,311",bedding down in this state tonight.
505,"00:35:40,770","00:35:44,316",This state spent three billion dollars last year...
506,"00:35:44,357","00:35:47,694",on services for those people who had no right to be here.
507,"00:35:47,736","00:35:49,321",Three billion dollars.
508,"00:35:49,362","00:35:53,867",$400 million just to lock up illegal immigrant criminals...
509,"00:35:53,908","00:35:57,829",who only got into this country because the INS decided...
510,"00:35:57,864","00:36:01,750",it's not worth the effort to screen for convicted felons.
511,"00:36:03,752","00:36:06,212",Our government doesn't give a shit.
512,"00:36:07,714","00:36:12,052","Our border policy is a joke, so is anybody surprised..."
513,"00:36:12,093","00:36:14,387",that south of the border they're laughing at us?
514,"00:36:14,429","00:36:16,681",Laughing at our laws?
515,"00:36:16,723","00:36:18,516","Every night, thousands of these parasites..."
516,"00:36:18,558","00:36:21,436",stream across the border like some fucking piñata exploded.
517,"00:36:21,478","00:36:25,106",Don't laugh. There's nothing funny here.
518,"00:36:25,148","00:36:27,192",This is about your life and mine.
519,"00:36:28,568","00:36:30,695","It's about decent, hard-working Americans..."
520,"00:36:30,737","00:36:32,572",falling through the cracks and getting the shaft...
521,"00:36:32,614","00:36:36,076",because their government cares more about the rights...
522,"00:36:36,111","00:36:38,370",of a bunch of people who aren't even citizens.
523,"00:36:38,411","00:36:40,455",On the Statue of Liberty it says...
524,"00:36:40,497","00:36:43,208","""Give me your tired, your hungry, your poor."""
525,"00:36:43,249","00:36:45,877","Well, it's Americans who are tired and hungry and poor."
526,"00:36:45,919","00:36:48,088",Until you take care of that...
527,"00:36:48,129","00:36:51,132","close the fucking book, because we're losing."
528,"00:36:52,217","00:36:55,679",We're losing our right to pursue our destiny.
529,"00:36:55,720","00:36:59,140",We're losing our freedom so a bunch of fucking foreigners...
530,"00:36:59,182","00:37:01,351",can come in here and exploit our country.
531,"00:37:01,393","00:37:04,479",And this isn't something that's going on far away.
532,"00:37:04,521","00:37:07,565",This isn't happening places we can't do anything about it.
533,"00:37:07,607","00:37:10,068",It's happening here. Right in our neighborhood.
534,"00:37:10,110","00:37:12,195",Right in that building behind you.
535,"00:37:12,237","00:37:15,699",Archie Miller ran that grocery store since we were kids here.
536,"00:37:15,740","00:37:18,583",Dave worked there. Mike worked there.
537,"00:37:18,618","00:37:20,996","He went under, and now some fucking Korean owns it..."
538,"00:37:21,037","00:37:23,540",who fired these guys and is making a killing...
539,"00:37:23,581","00:37:26,918",because he hired 40 fucking border jumpers.
540,"00:37:26,960","00:37:28,336",I see this shit going on...
541,"00:37:28,378","00:37:30,380",and I don't see anybody doing anything about it...
542,"00:37:30,422","00:37:32,299",and it fucking pisses me off.
543,"00:37:34,467","00:37:36,428",So look around you.
544,"00:37:37,679","00:37:38,805",This isn't our fucking neighborhood.
545,"00:37:38,847","00:37:41,599",It's a battlefield. We're on a battlefield tonight.
546,"00:37:41,641","00:37:43,310",Make a decision.
547,"00:37:43,351","00:37:46,021",Are we going to stand on the sidelines?
548,"00:37:46,062","00:37:48,732",Quietly standing there while our country gets raped?
549,"00:37:49,774","00:37:52,652",Are we going to ante up and do something about it?
550,"00:37:54,112","00:37:55,488",You're goddamn right.
551,"00:38:08,126","00:38:10,754",Come here! Don't you know it's illegal...
552,"00:38:10,795","00:38:13,423","to hire fucking border jumpers, you nip bastard?"
553,"00:38:21,181","00:38:22,641","Hey, sweetheart."
554,"00:38:22,682","00:38:24,851",No. You don't need this. We're not going to hurt you.
555,"00:38:24,893","00:38:26,478","Please, please! No!"
556,"00:38:29,439","00:38:30,649",You fucking spic!
557,"00:38:33,568","00:38:36,237",- No! Please! - This bitch deserves it.
558,"00:38:36,279","00:38:40,533",This bitch stinks. Smells like fish and chips and guacamole.
559,"00:38:40,575","00:38:42,035",Here we go.
560,"00:38:53,046","00:38:54,798",Goddamn!
561,"00:38:58,802","00:39:00,512","Get the fuck off me, motherfucker!"
562,"00:39:07,852","00:39:09,396",Viva la Mexico!
563,"00:39:14,234","00:39:16,236","Have a fucking bean, you fucking beaner!"
564,"00:39:23,910","00:39:27,205",Get some of that in there. Throw it on.
565,"00:39:27,247","00:39:29,124",That's a great color on you.
566,"00:39:29,165","00:39:31,084",Now you can get a white woman's job.
567,"00:39:31,126","00:39:33,128","A little better than this one, huh?"
568,"00:39:33,169","00:39:34,754","Yeah, white."
569,"00:39:34,796","00:39:36,631",Then you'll move up in the world.
570,"00:39:38,341","00:39:39,634",Asshole!
571,"00:39:41,594","00:39:42,721",Let's go!
572,"00:39:42,762","00:39:44,347",Everybody out!
573,"00:39:44,389","00:39:45,890",Now! Now!
574,"00:39:48,852","00:39:50,729","All right, let's go!"
575,"00:39:50,770","00:39:52,230",Come on!
576,"00:39:52,272","00:39:53,857","Come on, let's go."
577,"00:39:59,029","00:40:02,365","No green card, no fucking work. Comprende?"
578,"00:40:04,784","00:40:05,910",Come on!
579,"00:40:05,952","00:40:07,954",We're fucking going! Come on!
580,"00:40:34,314","00:40:38,234","Dad was gone, but things were almost normal again."
581,"00:40:38,276","00:40:39,986",Derek had a good job.
582,"00:40:40,028","00:40:41,780",Mom was starting to live a little.
583,"00:40:41,821","00:40:46,117","Everyone was feeling so good, we just didn't see it coming."
584,"00:40:46,159","00:40:47,869",Maybe we should've.
585,"00:40:47,911","00:40:50,205",The irony is that most of the stores...
586,"00:40:50,246","00:40:52,832",destroyed during the riots were owned by black people.
587,"00:40:52,874","00:40:55,961","That's stupid, though. Why trash your own neighborhood?"
588,"00:40:56,002","00:40:59,005","Well, that's my point. It's an irrational act."
589,"00:40:59,040","00:41:01,132",It's like an expression of rage...
590,"00:41:01,174","00:41:05,136",by people who feel neglected and turned away by the system.
591,"00:41:05,178","00:41:10,725",It's like we had in Watts or the riots in Chicago in '68.
592,"00:41:10,767","00:41:12,310",I don't buy that.
593,"00:41:12,352","00:41:14,813",Calling a riot an irrational expression of rage.
594,"00:41:14,854","00:41:17,732",That's such a cop-out. It's opportunism at its worst.
595,"00:41:17,774","00:41:19,985",It's people grabbing any excuse they can find...
596,"00:41:20,026","00:41:21,861","to go and loot a store, nothing more."
597,"00:41:21,903","00:41:24,197",The fact that these people ripped off the stores...
598,"00:41:24,239","00:41:26,199","in their own communities, all that reflects..."
599,"00:41:26,241","00:41:29,202",is that they have no respect for the law at all...
600,"00:41:29,237","00:41:31,830",and certainly no concept of community...
601,"00:41:31,871","00:41:33,540",or civic responsibility.
602,"00:41:33,581","00:41:34,749",Now wait a minute.
603,"00:41:34,791","00:41:37,335","White people commit crimes against white people, too."
604,"00:41:37,377","00:41:40,839","Yeah, but they're not offing each other in record numbers."
605,"00:41:40,880","00:41:42,841","Look at the statistics, for Christ's sake."
606,"00:41:42,882","00:41:45,010",One in every three black males...
607,"00:41:45,051","00:41:47,387",is in some phase of the correctional system.
608,"00:41:47,429","00:41:48,680",Is that a coincidence...
609,"00:41:48,722","00:41:51,558",or do these people have a racial commitment to crime?
610,"00:41:51,599","00:41:53,893",Not only that. They're proud of it.
611,"00:41:53,935","00:41:56,062",Maybe it says something about prejudice...
612,"00:41:56,104","00:41:57,272",in the judicial system.
613,"00:41:57,314","00:41:59,566",If you want to talk about criminal statistics...
614,"00:41:59,607","00:42:03,111",take a look at the social inequalities that produce them.
615,"00:42:03,153","00:42:05,196",That's exactly what I hate.
616,"00:42:05,238","00:42:08,325",You're taking one thing and calling it something else...
617,"00:42:08,366","00:42:10,744",and just alleviating the responsibility...
618,"00:42:10,785","00:42:12,370",these people have for their own actions.
619,"00:42:12,412","00:42:15,790","It's like saying, it's not a riot, it's rage."
620,"00:42:15,832","00:42:19,377","It's not crime, it's poverty. That's just nonsense."
621,"00:42:19,419","00:42:21,338",It's exactly what happened in this trial...
622,"00:42:21,379","00:42:23,131",because the media twisted things around...
623,"00:42:23,173","00:42:25,842",so people got all focused on these cops...
624,"00:42:25,884","00:42:27,218",and whether or not they were going to get convicted...
625,"00:42:27,260","00:42:30,388",and whether Rodney King's civil rights had been violated.
626,"00:42:30,430","00:42:32,641",Everybody lost sight of old Rodney King himself.
627,"00:42:32,682","00:42:35,769",The guy's a multiple felon by his own admission.
628,"00:42:35,810","00:42:37,646",He's high as a goddamn kite...
629,"00:42:37,687","00:42:40,357",driving 120 miles an hour down the highway.
630,"00:42:40,398","00:42:42,400",He gets pulled over by a bunch of cops...
631,"00:42:42,442","00:42:43,902",and he attacks them.
632,"00:42:43,943","00:42:45,236",He attacked police officers.
633,"00:42:45,278","00:42:46,745","That's the bottom line, and he walked."
634,"00:42:46,780","00:42:49,115",And there's some yahoo there with a video camera...
635,"00:42:49,157","00:42:50,533",who turned it on halfway through...
636,"00:42:50,575","00:42:52,911",so that all we see is them hitting him.
637,"00:42:52,953","00:42:56,581",You got Powell and Koon cracking him with billy clubs...
638,"00:42:56,623","00:42:58,875",and Briseno's kicking him in the back of the skull...
639,"00:42:58,917","00:43:00,293","so it looks severe, you know?"
640,"00:43:00,335","00:43:01,628","People are going, ""Oh, this poor guy."""
641,"00:43:01,670","00:43:03,672",This poor guy who attacked four cops...
642,"00:43:03,713","00:43:05,548",and those cops end up on the stand...
643,"00:43:05,590","00:43:10,178",defending themselves for using standard textbook procedures.
644,"00:43:10,220","00:43:12,305",I don't think the tapes showed that at all.
645,"00:43:12,347","00:43:15,433",You didn't think so? And you're an authority?
646,"00:43:15,475","00:43:17,769","Murray, what do you think?"
647,"00:43:19,479","00:43:23,400",I did think the police used their clubs rather excessively.
648,"00:43:23,441","00:43:25,110",Who are you to say what's excessive?
649,"00:43:25,151","00:43:26,820",I think it was totally appropriate.
650,"00:43:26,861","00:43:29,948",They're in a better position to make that call than you are.
651,"00:43:29,990","00:43:33,785","We, as society, grant cops a certain amount of authority..."
652,"00:43:33,827","00:43:35,996","to make those calls, because we acknowledge..."
653,"00:43:36,037","00:43:38,248",that their job is difficult and dangerous.
654,"00:43:38,290","00:43:42,168",Very few people respect that and respect that authority.
655,"00:43:42,203","00:43:45,088",Look who's talking about respect-Mr. Junior KKK.
656,"00:43:45,130","00:43:46,298",What?
657,"00:43:48,091","00:43:50,302",You want to go to college? Learn to listen.
658,"00:43:50,343","00:43:53,638",I didn't say I respect the laws. I acknowledge a cop's authority.
659,"00:43:53,680","00:43:57,225",I don't respect laws that let Rodney King back on the street.
660,"00:43:57,267","00:44:00,562","Second, I am not a member of a low-rent..."
661,"00:44:00,603","00:44:04,733",disorganized bunch of rednecks like the fucking KKK. Please.
662,"00:44:04,774","00:44:07,527",So take your head out of your ass.
663,"00:44:07,569","00:44:09,362",You've gotten off the point.
664,"00:44:09,404","00:44:11,990",I had a point. That wasn't even the point.
665,"00:44:12,032","00:44:13,950",Do you have one? What is your point?
666,"00:44:13,992","00:44:15,744","All right, think about this."
667,"00:44:15,785","00:44:18,288",If Danny was walking across the street that night...
668,"00:44:18,330","00:44:19,539",and Rodney King plowed into him-
669,"00:44:19,581","00:44:21,666",Can we drop this Rodney King thing?
670,"00:44:31,468","00:44:33,094",Who would like some dessert?
671,"00:44:34,929","00:44:36,014",We're having a discussion.
672,"00:44:36,056","00:44:38,391","We're having a nice discussion, right?"
673,"00:44:38,433","00:44:39,893",If Rodney King had been driving along...
674,"00:44:39,934","00:44:41,936",hopped up on PCP and had killed Danny...
675,"00:44:41,978","00:44:43,438",you'd be singing a different tune-
676,"00:44:43,480","00:44:46,441","I didn't see him hit anybody, and neither did you."
677,"00:44:46,483","00:44:49,110","He didn't happen to kill anybody, thank God."
678,"00:44:49,152","00:44:51,655","Keep it down, OK? Ally's sleeping."
679,"00:44:54,574","00:44:58,203",If that fucking monkey had run some kid over...
680,"00:44:58,244","00:45:01,456",everybody would have a very different opinion.
681,"00:45:01,498","00:45:04,709",They'd be focused on Rodney King and not on these officers.
682,"00:45:04,751","00:45:06,753","But instead, he just attacked a few cops..."
683,"00:45:06,795","00:45:08,546","so, suddenly, it's Hands Across America..."
684,"00:45:08,588","00:45:10,632",for this fucking total son of a bitch.
685,"00:45:10,674","00:45:12,057",It blows my mind.
686,"00:45:12,092","00:45:14,970",We're so hung up on this notion that we have some obligation...
687,"00:45:15,011","00:45:17,055",to help this struggling black man.
688,"00:45:17,097","00:45:19,391",Cut him some slack until he can overcome...
689,"00:45:19,432","00:45:20,732",these historical injustices.
690,"00:45:20,767","00:45:23,269",It's crap. This stuff just perpetuates it...
691,"00:45:23,311","00:45:24,813",all this liberal nonsense.
692,"00:45:24,854","00:45:26,314",Everyone's looking the other way...
693,"00:45:26,356","00:45:28,400",while our country rots from the inside out.
694,"00:45:28,441","00:45:32,028","I mean, Christ, Lincoln freed the slaves 130 years ago."
695,"00:45:32,070","00:45:34,114",How long does it take to get your act together?
696,"00:45:34,155","00:45:38,201","Jews have been persecuted for over 5,000 years."
697,"00:45:38,243","00:45:40,620",Are you saying it's wrong to feel sensitive...
698,"00:45:40,662","00:45:41,955",about anti-Semitism?
699,"00:45:41,997","00:45:43,331","Oh, forget that."
700,"00:45:43,373","00:45:46,418","I'm with you. I'm with you all the way, baby."
701,"00:45:46,459","00:45:48,253",I'm so sick of these liberal hypocrites.
702,"00:45:48,295","00:45:50,422",Here we go again. I love this part.
703,"00:45:50,463","00:45:51,506",This is great.
704,"00:45:51,548","00:45:53,466",Look how they scapegoated Chief Gates.
705,"00:45:53,508","00:45:56,136",Think they would've come down that hard on Willie Williams?
706,"00:45:56,177","00:45:59,556",No way. That videotape was a set-up to get rid of Gates.
707,"00:45:59,597","00:46:02,934",- Can I be excused? - No. Don't interrupt.
708,"00:46:02,976","00:46:05,270",Excuse me. I was talking. I listened to you.
709,"00:46:05,312","00:46:08,982",- Who do you think you are? - She's making a point.
710,"00:46:09,024","00:46:11,276","Davina, sit down."
711,"00:46:11,318","00:46:14,612",Be quiet! Shut up! Sit down!
712,"00:46:14,654","00:46:17,949","- Derek, calm down. - Don't tell him to shut up!"
713,"00:46:17,991","00:46:20,869",Sit your ass down. No. Sit down. Shut your mouth.
714,"00:46:20,910","00:46:23,538",Move! Goddamn it! Move!
715,"00:46:23,580","00:46:25,832",Shut your mouth and give my girlfriend respect.
716,"00:46:25,874","00:46:28,293","Derek, what are you trying to prove?"
717,"00:46:28,335","00:46:29,961","Murray, stay out of it!"
718,"00:46:30,003","00:46:32,130",Where do you think you're going?
719,"00:46:32,172","00:46:35,008","Derek, let her go!"
720,"00:46:35,050","00:46:38,553","You need to learn some fucking manners, Davina!"
721,"00:46:38,595","00:46:40,972",Shut your fucking mouth!
